{
  "PubDate": "2026-01-29T13:24:15+00:00",
  "FeedName": "Dellenny's Blog",
  "Author": "John Edward",
  "Title": "Microsoft 365, Copilot, and Copilot Studio: January News Roundup",
  "Link": "https://dellenny.com/microsoft-365-copilot-and-copilot-studio-january-news-roundup/",
  "EnhancedContent": "# Microsoft 365, Copilot, and Copilot Studio: January News Roundup\n\n- by [John Edward](https://dellenny.com/author/delenyprogmail-com/)\n- January 29, 2026January 29, 2026\n- [Artificial Intelligence](https://dellenny.com/category/artificial-intelligence/), [Copilot](https://dellenny.com/category/copilot/), [M365 Copilot](https://dellenny.com/category/m365-copilot/), [News](https://dellenny.com/category/news/)\n\n![](https://dellenny.com/wp-content/uploads/2026/01/januarycopilotnews-293x300.jpg)\n\n[previousAWS Certified AI Practitioner: What It Covers and How to Achieve It](https://dellenny.com/aws-certified-ai-practitioner-what-it-covers-and-how-to-achieve-it/)\n\nJanuary was a strong start to the year for Microsoft 365 and Copilot. Throughout the month, Microsoft released several meaningful updates that highlight how quickly its AI vision is evolving — from enterprise-grade agent governance to hands-on productivity improvements in everyday tools like Excel.\n\nRather than focusing on flashy one-off features, Microsoft’s January announcements show a clear strategy: **make Copilot reliable, scalable, and deeply embedded into how people work, learn, and build solutions**.\n\nBelow is a full breakdown of the most important Microsoft 365, Microsoft 365 Copilot, and Copilot Studio news released during January — and why it matters.\n\n## Copilot Studio: Preparing Organizations for an Agent-Driven Future\n\nOne of the most significant themes Microsoft emphasized in January was **agent readiness**. As more organizations move beyond experimenting with AI and start deploying multiple Copilot agents across teams, Microsoft outlined a structured approach to scaling responsibly.\n\nThe company introduced **six core pillars** that organizations should consider when adopting Copilot agents at scale. These pillars focus on practical, real-world concerns such as governance, visibility, cost management, performance tracking, and deployment consistency.\n\nThis guidance reflects a major shift in how AI is being positioned. Copilot agents are no longer treated as isolated assistants — they are becoming **digital teammates** that require oversight, lifecycle management, and integration into existing business processes.\n\nFor IT leaders and enterprise architects, this marks an important moment. Microsoft is acknowledging that AI adoption needs guardrails, standards, and operational clarity if it’s going to succeed long-term.\n\n## Copilot Studio and Visual Studio Code: A Big Win for Developers\n\nJanuary also brought good news for developers working with Copilot Studio. Microsoft announced that the **Copilot Studio extension for Visual Studio Code is now generally available**.\n\nThis update bridges the gap between low-code agent creation and professional software development. With this extension, developers can work on Copilot agents directly inside Visual Studio Code, using familiar workflows such as version control, collaboration, and structured development practices.\n\nFor teams building complex or enterprise-grade agents, this is a major improvement. It allows Copilot agents to be treated more like traditional software assets, rather than isolated configurations managed only through web interfaces.\n\nThis move reinforces Microsoft’s broader platform approach — giving both citizen developers and professional engineers the tools they need, without forcing them into a single development style.\n\n## Microsoft 365 Copilot in Excel: Agent Mode Expands\n\nExcel users saw one of the most tangible Copilot improvements in January with the **general availability of Agent Mode on desktop**. Previously introduced on the web, Agent Mode now extends to desktop users, bringing more powerful AI-assisted workflows directly into Excel.\n\nAgent Mode allows users to interact with Copilot in a more dynamic way. Instead of simple one-off prompts, users can guide Copilot through multi-step data analysis, transformations, and insights using natural language.\n\nAnother notable addition is the ability to switch between different AI models, giving users flexibility depending on the type of task they’re performing. This makes Copilot feel less like a static assistant and more like a customizable analytical partner.\n\nFor analysts, finance teams, and anyone working heavily with data, this update significantly reduces time spent on repetitive or complex spreadsheet tasks.\n\n## Microsoft 365 and AI in Education: Expanded Student Access\n\nMicrosoft also reinforced its commitment to education in January by expanding access to premium productivity and AI tools for students.\n\nEligible college students were offered **12 months of Microsoft 365 Premium alongside LinkedIn Premium Career**. This bundle gives students access to Copilot-powered tools across Word, Excel, PowerPoint, and more — as well as career development resources through LinkedIn.\n\nFrom writing assistance and presentation creation to resume building and job search support, this initiative positions Copilot as a learning companion, not just a workplace tool.\n\nIt also reflects Microsoft’s long-term strategy: helping students build AI literacy early, so they enter the workforce already comfortable collaborating with AI-powered tools\n\n## Why These January Updates Matter\n\nTaken together, January’s announcements paint a clear picture of where Microsoft 365 and Copilot are headed.\n\n### 1. AI Is Becoming Operational, Not Experimental\n\nMicrosoft is moving beyond “try it and see” AI adoption. The focus on governance, cost visibility, and performance tracking shows that Copilot is being designed for real-world, long-term use.\n\n### 2. Copilot Is for Everyone — Not Just Power Users\n\nFrom Excel Agent Mode to student offers, Microsoft is ensuring Copilot benefits knowledge workers, analysts, developers, educators, and learners alike.\n\n### 3. Developers Are Central to the Copilot Ecosystem\n\nBy bringing Copilot Studio into Visual Studio Code, Microsoft is making it easier to build, maintain, and scale intelligent agents using professional development practices.\n\n### 4. AI Is Embedded Across the Microsoft 365 Stack\n\nRather than standing apart, Copilot continues to integrate more deeply into familiar apps, reducing friction and increasing everyday value.\n\n## What to Expect Next\n\nIf January is any indication, the coming months will continue to expand Copilot’s reach across Microsoft 365. Organizations can expect:\n\n- Deeper Copilot integrations across Teams, Outlook, and PowerPoint\n- More enterprise governance and analytics capabilities\n- Continued evolution of agent-based workflows\n- Expanded access and offers across education and business segments\n\nMicrosoft’s vision is clear: **Copilot is not an add-on — it’s becoming the connective intelligence layer of Microsoft 365**.\n\n### Share this:\n\n- [Click to share on Facebook (Opens in new window) Facebook](https://dellenny.com/microsoft-365-copilot-and-copilot-studio-january-news-roundup/?share=facebook)\n- [Click to share on X (Opens in new window) X](https://dellenny.com/microsoft-365-copilot-and-copilot-studio-january-news-roundup/?share=x)\n- [Click to share on LinkedIn (Opens in new window) LinkedIn](https://dellenny.com/microsoft-365-copilot-and-copilot-studio-january-news-roundup/?share=linkedin)\n- [Click to share on Telegram (Opens in new window) Telegram](https://dellenny.com/microsoft-365-copilot-and-copilot-studio-january-news-roundup/?share=telegram)\n- [Click to share on WhatsApp (Opens in new window) WhatsApp](https://dellenny.com/microsoft-365-copilot-and-copilot-studio-january-news-roundup/?share=jetpack-whatsapp)\n-\n\n### Like this:\n\nLike Loading...\n\n### *Related*\n\n### Extra posts:\n\n[!\\[\\](https://dellenny.com/wp-content/uploads/2025/10/copilotstudiodigitaltwin-150x150.webp)The ‘Digital Twin’ Employee Creating Hyper-Personalized Copilot Prompts with Copilot Studio](https://dellenny.com/the-digital-twin-employee-creating-hyper-personalized-copilot-prompts-with-copilot-studio/) [!\\[\\](https://dellenny.com/wp-content/uploads/2025/08/copilotstudio1-150x150.webp)What Is Microsoft Copilot Studio? A Beginner’s Guide](https://dellenny.com/what-is-microsoft-copilot-studio-a-beginners-guide/) [!\\[\\](https://dellenny.com/wp-content/uploads/2025/09/travelCopilot-150x150.webp)Stress-Free Travel How to Use Microsoft 365 and Copilot to Plan Your Vacation or Business Trip](https://dellenny.com/stress-free-travel-how-to-use-microsoft-365-and-copilot-to-plan-your-vacation-or-business-trip/) [!\\[\\](https://dellenny.com/wp-content/uploads/2025/08/copilotstudio2-150x150.webp)Top 5 Use Cases for Copilot Studio in Your Business](https://dellenny.com/top-5-use-cases-for-copilot-studio-in-your-business/) [!\\[\\](https://dellenny.com/wp-content/uploads/2025/11/copilotdevguide-150x150.jpg)Using Copilot Studio with Dataverse: A Developer’s Guide](https://dellenny.com/using-copilot-studio-with-dataverse-a-developers-guide/) [!\\[\\](https://dellenny.com/wp-content/uploads/2025/11/copilotstudiodebugging-150x150.jpg)Debugging and Testing Your Copilot Studio Bots Efficiently](https://dellenny.com/debugging-and-testing-your-copilot-studio-bots-efficiently/)\n\n## Leave a Reply\n\nYou must be [logged in](https://dellenny.com/wp-login.php?redirect_to=https%3A%2F%2Fdellenny.com%2Fmicrosoft-365-copilot-and-copilot-studio-january-news-roundup%2F) to post a comment.\n\n%d",
  "Tags": [
    "Artificial Intelligence",
    "Copilot",
    "M365 Copilot",
    "News"
  ],
  "Description": "January was a strong start to the year for Microsoft 365 and Copilot. Throughout the month, Microsoft released several meaningful updates that highlight how quickly its AI vision is evolving — from enterprise-grade agent governance to hands-on productivity improvements in everyday tools like Excel. Rather than focusing on flashy one-off features, Microsoft’s January announcements show… [Microsoft 365, Copilot, and Copilot Studio: January News Roundup](https://dellenny.com/microsoft-365-copilot-and-copilot-studio-january-news-roundup/)\n\nThe post [Microsoft 365, Copilot, and Copilot Studio: January News Roundup](https://dellenny.com/microsoft-365-copilot-and-copilot-studio-january-news-roundup/) appeared first on [Dellenny](https://dellenny.com).\n\n### Related posts:\n\n1. [The ‘Digital Twin’ Employee Creating Hyper-Personalized Copilot Prompts with Copilot Studio](https://dellenny.com/the-digital-twin-employee-creating-hyper-personalized-copilot-prompts-with-copilot-studio/) In today’s fast-paced business landscape, employees are expected to process...\n2. [What Is Microsoft Copilot Studio? A Beginner’s Guide](https://dellenny.com/what-is-microsoft-copilot-studio-a-beginners-guide/) In today’s AI-driven world, tools that help businesses and individuals...\n3. [Stress-Free Travel How to Use Microsoft 365 and Copilot to Plan Your Vacation or Business Trip](https://dellenny.com/stress-free-travel-how-to-use-microsoft-365-and-copilot-to-plan-your-vacation-or-business-trip/) Planning a trip should be exciting—but between flights, hotels, expenses,...",
  "ProcessedDate": "2026-01-29 15:10:35",
  "OutputDir": "_blogs",
  "FeedLevelAuthor": "Dellenny",
  "FeedUrl": "https://dellenny.com/feed/"
}
