{
  "Link": "https://dellenny.com/visualize-workflows-and-architecture-with-mermaid-charts-in-visual-studio-2026/",
  "PubDate": "2026-02-15T10:58:23+00:00",
  "Description": "Modern software systems are more complex than ever. Microservices talk to APIs. Background workers process queues. Frontend apps interact with authentication layers, caching services, and databases. In the middle of all this complexity, one thing becomes absolutely critical: clear visualization. With Visual Studio 2026, developers no longer need third-party plugins to visualize workflows and architecture.… [Visualize Workflows and Architecture with Mermaid Charts in Visual Studio 2026](https://dellenny.com/visualize-workflows-and-architecture-with-mermaid-charts-in-visual-studio-2026/)\n\nThe post [Visualize Workflows and Architecture with Mermaid Charts in Visual Studio 2026](https://dellenny.com/visualize-workflows-and-architecture-with-mermaid-charts-in-visual-studio-2026/) appeared first on [Dellenny](https://dellenny.com).\n\n### Related posts:\n\n1. [Integrating Copilot Studio with Power Automate for End-to-End Workflows](https://dellenny.com/integrating-copilot-studio-with-power-automate-for-end-to-end-workflows/) Microsoft’s Copilot Studio is quickly becoming a go-to tool for...\n2. [Modern SharePoint Architecture: Best Practices for Scalable Intranets in 2026](https://dellenny.com/modern-sharepoint-architecture-best-practices-for-scalable-intranets-in-2026/) In 2026, SharePoint has evolved from being a basic collaboration...\n3. [Microsoft 365 Copilot and the Future of Visual Agent Is It Deprecated or Replaced?](https://dellenny.com/microsoft-365-copilot-and-the-future-of-visual-agent-is-it-deprecated-or-replaced/) The AI Agent Evolution in Microsoft 365 Copilot Microsoft 365...",
  "ProcessedDate": "2026-02-15 11:04:08",
  "FeedName": "Dellenny's Blog",
  "FeedLevelAuthor": "Dellenny",
  "Tags": [
    "Architecture",
    "Artificial Intelligence",
    "Copilot",
    "Github Copilot",
    "Solution Architecture"
  ],
  "Title": "Visualize Workflows and Architecture with Mermaid Charts in Visual Studio 2026",
  "OutputDir": "_blogs",
  "Author": "John Edward",
  "EnhancedContent": "# Visualize Workflows and Architecture with Mermaid Charts in Visual Studio 2026\n\n- by [John Edward](https://dellenny.com/author/delenyprogmail-com/)\n- February 15, 2026February 15, 2026\n- [Architecture](https://dellenny.com/category/architecture/), [Artificial Intelligence](https://dellenny.com/category/artificial-intelligence/), [Github Copilot](https://dellenny.com/category/github-copilot/)\n\nTags:[Artificial Intelligence](https://dellenny.com/tag/artificial-intelligence-2/ \"Artificial Intelligence\")[Copilot](https://dellenny.com/tag/copilot/ \"Copilot\")[Solution Architecture](https://dellenny.com/tag/solution-architecture/ \"Solution Architecture\")\n\n![](https://dellenny.com/wp-content/uploads/2026/02/visualstudio2026mermaid-300x280.jpg)\n\n[previousModern SharePoint Architecture: Best Practices for Scalable Intranets in 2026](https://dellenny.com/modern-sharepoint-architecture-best-practices-for-scalable-intranets-in-2026/)\n\nModern software systems are more complex than ever. Microservices talk to APIs. Background workers process queues. Frontend apps interact with authentication layers, caching services, and databases. In the middle of all this complexity, one thing becomes absolutely critical: **clear visualization**.\n\nWith Visual Studio 2026, developers no longer need third-party plugins to visualize workflows and architecture. Visual Studio 2026 renders **Mermaid charts directly in the editor — no extensions required**.\n\nYou can write Mermaid syntax yourself or let GitHub Copilot generate it for you. Flowcharts, sequence diagrams, and other visualizations render inline, keeping documentation inside your development workflow.\n\nThis is more than just a convenience feature. It’s a shift in how developers document, collaborate, and communicate system design.\n\n## Native Mermaid Support: Why It Matters\n\nIn previous IDE versions, visual diagrams required:\n\n- External diagramming tools\n- Manual exports (PNG, SVG, PDF)\n- Marketplace extensions\n- Separate documentation systems\n\nWith Visual Studio 2026, Mermaid is built in. That means:\n\n- No plugin installation\n- No external rendering tools\n- No context switching\n- No synchronization issues between diagrams and code\n\nThe diagram lives right next to your source code — and updates instantly.\n\nThis native support eliminates friction. And when friction disappears, developers are far more likely to keep documentation up to date.\n\n## What Is Mermaid?\n\nMermaid is a text-based diagramming language. Instead of dragging shapes onto a canvas, you describe relationships using structured syntax.\n\nFor example, a simple workflow:\n\n``` flowchart TD User --> WebApp WebApp --> API API --> Database ```\n\nIn Visual Studio 2026, this code block renders immediately inside the editor as a visual flowchart.\n\nNo extra configuration required.\n\n## Writing Mermaid Syntax Directly in the Editor\n\nYou can create a Markdown file (`.md` ) or use supported documentation blocks inside your solution.\n\nAs soon as you define a Mermaid block, Visual Studio renders it inline.\n\nFor example, a layered architecture diagram:\n\n``` graph LR Client --> PresentationLayer PresentationLayer --> BusinessLayer BusinessLayer --> DataAccessLayer DataAccessLayer --> SQLServer ```\n\nThis is ideal for documenting:\n\n- Clean architecture\n- N-tier systems\n- Microservices structures\n- Domain-driven designs\n\nBecause rendering happens directly inside Visual Studio 2026, you don’t need to preview in a browser or export images manually.\n\n## Let Copilot Generate Your Diagrams\n\nNot sure how to write Mermaid syntax? Let AI help.\n\nWith GitHub Copilot integrated into Visual Studio 2026, you can describe your architecture in plain English, and Copilot can generate the Mermaid diagram for you.\n\nFor example:\n\n>\n> “Generate a sequence diagram for a login process with user, frontend, API, and database.”\n>\n\nCopilot produces structured Mermaid syntax, and the IDE instantly renders it.\n\nThis dramatically lowers the barrier to creating diagrams. Developers who previously avoided documentation can now generate visualizations in seconds.\n\n## Visualizing Workflows\n\nWorkflows describe how data and logic move through your system. These are essential when:\n\n- Designing new features\n- Explaining system behavior\n- Debugging complex processes\n- Onboarding new team members\n\nExample: CI/CD workflow\n\n``` flowchart TD Developer --> GitPush GitPush --> Build Build --> Test Test --> Deploy Deploy --> Production ```\n\nWith inline rendering, your pipeline is visualized immediately — right inside your solution.\n\nYou no longer need to open diagram software or paste screenshots into documentation.\n\n## Sequence Diagrams for Runtime Interactions\n\nSequence diagrams are powerful for showing time-based interactions between components.\n\nExample:\n\n``` sequenceDiagram participant User participant Frontend participant API participant Database User->>Frontend: Submit Login Frontend->>API: POST /login API->>Database: Validate Credentials Database-->>API: Result API-->>Frontend: Token Frontend-->>User: Login Success ```\n\nVisual Studio 2026 renders this automatically, helping teams understand request-response flows at a glance.\n\nThese diagrams are especially valuable in distributed systems and microservices architectures.\n\n## Keeping Documentation Inside Your Workflow\n\nOne of the biggest challenges in software development is outdated documentation.\n\nTraditional documentation tools create separation:\n\n- Code lives in the IDE\n- Diagrams live somewhere else\n- Updates are forgotten\n\nNative Mermaid support eliminates this separation.\n\nBecause diagrams are text-based and version-controlled:\n\n- Changes are tracked in Git\n- Diagram updates appear in pull requests\n- Architecture evolves alongside code\n\nWhen documentation is part of your workflow, it stays current.\n\n## Architecture Visualization Made Practical\n\nWhether you’re designing:\n\n- Event-driven systems\n- Microservices architectures\n- Serverless workflows\n- Monolithic enterprise apps\n\nMermaid diagrams provide fast, maintainable visualization.\n\nExample: Microservices architecture\n\n``` graph TD Client --> APIGateway APIGateway --> AuthService APIGateway --> OrderService OrderService --> Database AuthService --> IdentityProvider ```\n\nInstead of creating static architecture slides, you maintain living diagrams inside your repository.\n\nThis improves collaboration between developers, architects, DevOps engineers, and stakeholders.\n\n## Inline Rendering Improves Productivity\n\nRendering diagrams inline provides three major productivity benefits:\n\n### 1. Immediate Feedback\n\nAs you type, diagrams update in real time.\n\n### 2. Reduced Context Switching\n\nYou stay inside Visual Studio — no switching to browser tools or desktop apps.\n\n### 3. Faster Communication\n\nSharing architecture is as simple as sharing a Markdown file.\n\nIn fast-moving teams, these small efficiency gains compound quickly.\n\n## Use Cases for Native Mermaid in Visual Studio 2026\n\nHere are practical ways teams are using native Mermaid rendering:\n\n- Documenting new feature workflows\n- Visualizing database relationships\n- Designing API interaction flows\n- Planning DevOps pipelines\n- Explaining refactoring strategies\n- Creating onboarding materials\n\nBecause everything stays inside Visual Studio 2026, teams maintain a single source of truth.\n\n## The Bigger Picture: Documentation as Code\n\nNative Mermaid support reinforces a powerful development philosophy: **documentation as code**.\n\nInstead of treating diagrams as static assets, they become:\n\n- Editable\n- Reviewable\n- Version-controlled\n- Collaborative\n\nWith Mermaid built directly into Visual Studio 2026, architecture communication becomes faster, clearer, and more integrated.\n\nYou don’t leave your IDE. You don’t install extensions. You don’t export images.\n\nYou simply write — and see.\n\n### Share this:\n\n- [Click to share on Facebook (Opens in new window) Facebook](https://dellenny.com/visualize-workflows-and-architecture-with-mermaid-charts-in-visual-studio-2026/?share=facebook)\n- [Click to share on X (Opens in new window) X](https://dellenny.com/visualize-workflows-and-architecture-with-mermaid-charts-in-visual-studio-2026/?share=x)\n- [Click to share on LinkedIn (Opens in new window) LinkedIn](https://dellenny.com/visualize-workflows-and-architecture-with-mermaid-charts-in-visual-studio-2026/?share=linkedin)\n- [Click to share on Telegram (Opens in new window) Telegram](https://dellenny.com/visualize-workflows-and-architecture-with-mermaid-charts-in-visual-studio-2026/?share=telegram)\n- [Click to share on WhatsApp (Opens in new window) WhatsApp](https://dellenny.com/visualize-workflows-and-architecture-with-mermaid-charts-in-visual-studio-2026/?share=jetpack-whatsapp)\n-\n\n### Like this:\n\nLike Loading...\n\n### *Related*\n\n### Extra posts:\n\n[!\\[\\](https://dellenny.com/wp-content/uploads/2025/08/copilotpowerautomate-150x150.webp)Integrating Copilot Studio with Power Automate for End-to-End Workflows](https://dellenny.com/integrating-copilot-studio-with-power-automate-for-end-to-end-workflows/) [!\\[\\](https://dellenny.com/wp-content/uploads/2026/02/sharepointmodernarchitetcure-150x150.jpg)Modern SharePoint Architecture: Best Practices for Scalable Intranets in 2026](https://dellenny.com/modern-sharepoint-architecture-best-practices-for-scalable-intranets-in-2026/) [!\\[\\](https://dellenny.com/wp-content/uploads/2025/10/copilotagentupdates-150x150.webp)Microsoft 365 Copilot and the Future of Visual Agent Is It Deprecated or Replaced?](https://dellenny.com/microsoft-365-copilot-and-the-future-of-visual-agent-is-it-deprecated-or-replaced/) [!\\[\\](https://dellenny.com/wp-content/uploads/2025/09/documentingArchitetcure-150x150.webp)Documenting Architecture Using AI From Painful Chore to Strategic Advantage](https://dellenny.com/documenting-architecture-using-ai-from-painful-chore-to-strategic-advantage/) [!\\[\\](https://dellenny.com/wp-content/uploads/2025/09/architectureAI-150x150.webp)Software Architecture Frameworks and Artificial Intelligence Building Smarter Systems](https://dellenny.com/software-architecture-frameworks-and-artificial-intelligence-building-smarter-systems/) [!\\[\\](https://dellenny.com/wp-content/uploads/2025/11/solutionvssoftwarearchitecture-150x150.jpg)What Is Solution Architecture and How Does It Differ from Software Architecture?](https://dellenny.com/what-is-solution-architecture-and-how-does-it-differ-from-software-architecture/)\n\n## Leave a Reply\n\nYou must be [logged in](https://dellenny.com/wp-login.php?redirect_to=https%3A%2F%2Fdellenny.com%2Fvisualize-workflows-and-architecture-with-mermaid-charts-in-visual-studio-2026%2F) to post a comment.\n\n%d",
  "FeedUrl": "https://dellenny.com/feed/"
}
