{
  "ProcessedDate": "2025-12-04 16:04:36",
  "Author": "John Edward",
  "FeedUrl": "https://dellenny.com/feed/",
  "Description": "AI i changing the workplace very fast than any other time. Using Microsoft 365 Copilot can help organizations get the true potential of their internal knowledge. SharePoint as the backbone of content and collaboration becomes even more powerful when connected to Copilot Insights. The integration between SharePoint and Copilot Insights gives the chance to users‚Ä¶ [Connecting SharePoint Data to Copilot Insights A Complete Guide to Smarter Collaboration](https://dellenny.com/connecting-sharepoint-data-to-copilot-insights-a-complete-guide-to-smarter-collaboration/)\n\nThe post [Connecting SharePoint Data to Copilot Insights A Complete Guide to Smarter Collaboration](https://dellenny.com/connecting-sharepoint-data-to-copilot-insights-a-complete-guide-to-smarter-collaboration/) appeared first on [Dellenny](https://dellenny.com).",
  "FeedLevelAuthor": "Dellenny",
  "FeedName": "Dellenny's Blog",
  "Link": "https://dellenny.com/connecting-sharepoint-data-to-copilot-insights-a-complete-guide-to-smarter-collaboration/",
  "PubDate": "2025-12-04T15:04:03+00:00",
  "Tags": [
    "AI",
    "Artificial Intelligence",
    "M365 Copilot",
    "Microsoft 365",
    "SharePoint"
  ],
  "EnhancedContent": "# Connecting SharePoint Data to Copilot Insights A Complete Guide to Smarter Collaboration\n\n- by [John Edward](https://dellenny.com/author/delenyprogmail-com/)\n- December 4, 2025December 4, 2025\n\n![](https://i0.wp.com/dellenny.com/wp-content/uploads/2025/12/sharepointCopilotinsights.jpg?fit=300%2C163&amp;ssl=1)\n\nAI i changing the workplace very fast than any other time. Using Microsoft 365 Copilot can help organizations get the true potential of their internal knowledge. SharePoint as the backbone of content and collaboration becomes even more powerful when connected to Copilot Insights.\n\nThe integration between SharePoint and Copilot Insights gives the chance to users ask natural questions about their organization‚Äôs data and receive instant, intelligent answers, with no more digging through folders or chasing document versions.\n\nIn this blog, we will walkthrough exploring why connecting SharePoint to Copilot Insights matters, how to configure your tenant for maximum success.\n\n## What Is Copilot Insights?\n\nCopilot Insights is a component within Microsoft Copilot that analyzes business content to deliver meaningful answers, summaries, trends, and recommendations. It works across files, chats, lists, and more helping employees find exactly what they need with a simple question:\n\n- ‚ÄúWhat are our latest supply chain issues mentioned in SharePoint reports?‚Äù\n- ‚ÄúSummarize onboarding documentation from HR sites.‚Äù\n- ‚ÄúCreate a project update using SharePoint list data.‚Äù\n\nCopilot transforms stored content into actionable intelligence unlocking organizational productivity.\n\n## Why Connect SharePoint to Copilot Insights?\n\nSharePoint hosts critical data like:\n\n‚úî Documents ‚úî Lists and databases ‚úî Project records ‚úî Policies and procedures ‚úî Customer and product knowledge\n\nTraditional search makes it hard to locate information quickly. When Copilot Insights analyzes SharePoint:\n\n| Benefit | What It Means | | --- | --- | | Faster discovery | Ask ‚Üí get precise answers instantly | | Automated summaries | Copilot reads entire document libraries for you | | Cross-department insights | Breaks down content silos | | Security-aware | Respects all permissions and sensitivity labels | | Higher productivity | Less time searching, more time delivering value |\n\nso with this way your organization becomes *smarter* using the knowledge it already owns.\n\n## How to Connect SharePoint Data to Copilot Insights\n\nTo ensure smooth integration, IT admins should follow these configuration steps:\n\n### **Step 1 Validate Licensing**\n\n1. Open **Microsoft 365 Admin Center**\n2. Assign Copilot licenses to users:\n**Users ‚Üí Active Users ‚Üí Licenses & Apps ‚Üí Enable Microsoft 365 Copilot**\n\n>\n> Without licensing, users cannot query SharePoint with Copilot Insights.\n>\n\n### **Step 2 Review Security & Permissions**\n\nCopilot only surfaces content users are allowed to view.\n\nAdmin recommendations:\n\n- Use SharePoint groups for controlled access\n- Restrict high-confidential sites\n- Apply **Microsoft Purview Sensitivity Labels**\n\n### **Step 3 Strengthen SharePoint Information Architecture**\n\nWell-organized data ‚Üí better AI results\n\n| Structure | Recommendation | | --- | --- | | Libraries | Use consistent naming conventions | | Lists | Add columns with metadata & validation rules | | Metadata | Define department, project, region tags | | Content Types | Standardize file templates |\n\nConsider using **Managed Metadata Services** for enterprise tagging.\n\n### **Step 4 Enable Microsoft Graph Permissions**\n\nCopilot relies on Graph to interpret and deliver insights.\n\nIn Azure: Allow Graph access for SharePoint content (ex: Sites.Read.All)\n\nEnsure Conditional Access does not block Copilot services.\n\n![](https://i0.wp.com/dellenny.com/wp-content/uploads/2025/12/image-3.png?fit=691%2C352&amp;ssl=1)\n### **Step 5 Test with Real-World Scenarios**\n\nExamples for validation:\n\n- ‚ÄúShow the last 10 documents updated in the IT SharePoint site.‚Äù\n- ‚ÄúSummarize employee survey data in our HR list.‚Äù\n- ‚ÄúCreate a competitive review using SharePoint marketing files.‚Äù\n\nIf Copilot can answer accurately ‚Üí integration succeeded ‚úî\n\n## üß™ Admin Automation Commands (Optional)\n\nCheck SharePoint crawl status:\n\n``` Get-SPOSite -Limit All | Select Url, CrawlStatus\n\n```\n\nIndex all sites for customization compatibility:\n\n``` Connect-SPOService -Url https://<tenant>-admin.sharepoint.com Get-SPOSite -Limit All | Set-SPOSite -DenyAddAndCustomizePages 0\n\n```\n\nOnly run scripts if you understand configuration impacts.\n\n## Best Practices for Optimal Insights\n\n| Best Practice | Impact | | --- | --- | | Clean up outdated content | Reduces irrelevant AI results | | Limit file duplication | Improves accuracy of knowledge | | Regular governance reviews | Maintains security and compliance | | End-user training | Ensures successful adoption |\n\nBetter data = smarter Copilot outcomes.\n\n## Real Business Use Cases\n\nIndustries already seeing success:\n\n‚úî **Healthcare:** Analyzing large patient care policy libraries ‚úî **Finance:** Compliance audit summaries straight from regulated documents ‚úî **Manufacturing:** Automated reporting from SharePoint lists ‚úî **Sales:** Proposal generation using internal pitch files and templates ‚úî **HR:** Insights pulled from onboarding procedures and surveys\n\nAI becomes a strategic partner when knowledge becomes searchable and contextual.\n\n## The Future of SharePoint + Copilot\n\nSoon, organizations will see:\n\n- Predictive insights from historical list data\n- Automated reminders based on content changes\n- AI driven governance suggestions\n- Smart content categorization without manual tagging\n\nThe workplace will shift from *finding* information to *being informed*.\n\nConnecting SharePoint data to Copilot Insights is one of the most impactful upgrades an organization can make in Microsoft 365. It transforms SharePoint from a storage system into an enterprise intelligence engine‚Äîimproving collaboration, accelerating decisions, and unlocking innovation.\n\n### Share this:\n\n- [Click to share on Facebook (Opens in new window) Facebook](https://dellenny.com/connecting-sharepoint-data-to-copilot-insights-a-complete-guide-to-smarter-collaboration/?share=facebook)\n- [Click to share on X (Opens in new window) X](https://dellenny.com/connecting-sharepoint-data-to-copilot-insights-a-complete-guide-to-smarter-collaboration/?share=x)\n- [Click to share on LinkedIn (Opens in new window) LinkedIn](https://dellenny.com/connecting-sharepoint-data-to-copilot-insights-a-complete-guide-to-smarter-collaboration/?share=linkedin)\n- [Click to share on Telegram (Opens in new window) Telegram](https://dellenny.com/connecting-sharepoint-data-to-copilot-insights-a-complete-guide-to-smarter-collaboration/?share=telegram)\n- [Click to share on WhatsApp (Opens in new window) WhatsApp](https://dellenny.com/connecting-sharepoint-data-to-copilot-insights-a-complete-guide-to-smarter-collaboration/?share=jetpack-whatsapp)\n-\n\n### Like this:\n\nLike Loading...\n\n### *Related*\n\n### Discover more from Dellenny\n\nSubscribe to get the latest posts sent to your email.\n\nType your email‚Ä¶\n\nTags:[Artificial Intelligence](https://dellenny.com/tag/artificial-intelligence-2/ \"Artificial Intelligence\")[M365 Copilot](https://dellenny.com/tag/m365-copilot/ \"M365 Copilot\")[SharePoint](https://dellenny.com/tag/sharepoint/ \"SharePoint\")\n\n[previousUsing Copilot in Loop Components for Seamless Collaboration](https://dellenny.com/using-copilot-in-loop-components-for-seamless-collaboration/)\n\n## Leave a Reply\n\nYour email address will not be published. Required fields are marked \\*\n\nName \\*\n\nEmail \\*\n\nWebsite\n\nComment \\*\n\n%d",
  "OutputDir": "_blogs",
  "Title": "Connecting SharePoint Data to Copilot Insights A Complete Guide to Smarter Collaboration"
}
