{
  "Tags": [
    "Artificial Intelligence",
    "M365 Copilot",
    "Microsoft 365",
    "SharePoint"
  ],
  "OutputDir": "_posts",
  "Description": "Microsoft 365 Copilot has crossed an important threshold. It is no longer just a clever chat interface that summarizes documents or drafts emails. In 2025, Copilot is becoming agentic—capable of acting, orchestrating tasks, and reasoning across your organization’s knowledge landscape. And that’s exactly why many IT leaders are nervous. The Real Problem: Copilot Is Too… [The “Agentic” Intranet: Securing and Scaling M365 Copilot with SharePoint & Teams](https://dellenny.com/the-agentic-intranet-securing-and-scaling-m365-copilot-with-sharepoint-teams/)\n\nThe post [The “Agentic” Intranet: Securing and Scaling M365 Copilot with SharePoint & Teams](https://dellenny.com/the-agentic-intranet-securing-and-scaling-m365-copilot-with-sharepoint-teams/) appeared first on [Dellenny](https://dellenny.com).",
  "Author": "John Edward",
  "FeedUrl": "https://dellenny.com/feed/",
  "ProcessedDate": "2025-12-22 16:04:45",
  "Title": "The “Agentic” Intranet: Securing and Scaling M365 Copilot with SharePoint & Teams",
  "FeedName": "Dellenny's Blog",
  "FeedLevelAuthor": "Dellenny",
  "EnhancedContent": "# The “Agentic” Intranet: Securing and Scaling M365 Copilot with SharePoint & Teams\n\n- by [John Edward](https://dellenny.com/author/delenyprogmail-com/)\n- December 22, 2025December 22, 2025\n\n![](https://i0.wp.com/dellenny.com/wp-content/uploads/2025/12/agenticsharepoint.jpg?fit=300%2C261&amp;ssl=1)\n\nMicrosoft 365 Copilot has crossed an important threshold. It is no longer just a clever chat interface that summarizes documents or drafts emails. In 2025, Copilot is becoming *agentic*—capable of acting, orchestrating tasks, and reasoning across your organization’s knowledge landscape.\n\nAnd that’s exactly why many IT leaders are nervous.\n\n### The Real Problem: Copilot Is *Too* Good at Finding Data\n\nCopilot doesn’t invent access. It respects permissions. But if your SharePoint and Teams permissions are chaotic—and let’s be honest, most tenants that grew organically over five to ten years are—Copilot becomes something far more dangerous than a productivity tool.\n\nIt becomes a **corporate data leak machine**.\n\nOvershared SharePoint sites, broken inheritance, “Everyone Except External Users,” abandoned Teams, and legacy access models mean Copilot can surface information users technically *can* access, but absolutely *should not* see in context.\n\n### The Shift: From Generative AI to Agentic AI\n\nEarly Copilot adoption was about asking questions:\n\n- “Summarize this document”\n- “Draft a response”\n- “Explain this spreadsheet”\n\nAgentic AI changes the model:\n\n- “Prepare the weekly project update”\n- “Monitor risks across Project Alpha”\n- “Answer HR questions using approved policies only”\n\nThis shift demands **intentional architecture**.\n\n### The Goal: A Secure, AI-Powered Knowledge Brain\n\nThis blog lays out a **practical, four-phase blueprint** to transform a standard Microsoft 365 tenant into a secure, compliant, and scalable **Agentic Intranet**—one where Copilot agents operate with precision, context, and guardrails.\n\n## Phase 1: Hardening the Foundation (SharePoint & Purview)\n\nBefore you deploy Copilot at scale—or build agents—you must confront oversharing. This is not optional. This is existential.\n\n### Audit Before You Deploy: Finding Oversharing at Scale\n\nManual permission reviews do not work in large tenants. You need automation.\n\n**SharePoint Advanced Management (SAM)** is the unsung hero here. It allows you to:\n\n- Identify sites with **Restricted Access Control gaps**\n- Detect broken inheritance patterns\n- Flag anonymous or “anyone with the link” sharing\n- Report on high-risk permission sprawl across OneDrive and SharePoint\n\nThe key insight: *Do this before Copilot becomes business-critical.* Once users rely on Copilot, tightening permissions feels like a productivity regression—even when it’s a security win.\n\n### The “5×5” Labeling Strategy (Purview Without Pain)\n\nMost organizations fail at sensitivity labels not because the technology is bad, but because the taxonomy is unusable.\n\nThe **5×5 strategy** works:\n\n- **5 parent labels max** (e.g., Public, Internal, Confidential, Highly Confidential, Regulated)\n- **5 sub-labels per parent** for business nuance\n\nWhy this matters:\n\n- Reduces user fatigue\n- Improves label accuracy\n- Makes Copilot grounding more reliable\n\nPair this with **auto-labeling policies** in Microsoft Purview:\n\n- Detect financial data, PII, contracts, or IP\n- Apply labels automatically\n- Reduce human error\n\nCopilot respects these labels. Agents inherit these boundaries. This is foundational.\n\n### Just-in-Time Access: Ending “Open by Default”\n\nThe old intranet model assumed discoverability was always good. The agentic intranet assumes **intentional discovery**.\n\nAdopt:\n\n- **Restricted Content Discovery**\n- Time-bound access for sensitive libraries\n- Approval-based sharing for high-risk sites\n\nThis doesn’t slow users down—it protects them from accidental exposure amplified by AI.\n\n## Phase 2: Teams as the AI Work Hub\n\nTeams is no longer just a collaboration tool. It is becoming the **primary UI for AI in Microsoft 365**.\n\n### Teams as the Control Plane for Agents\n\nWith **Agent 365 (the unified control plane announced for 2025)**, IT now has a centralized way to manage:\n\n- Which Copilot agents exist\n- Which Teams, channels, or chats they can operate in\n- What data scopes they can access\n\nThis is a major governance shift.\n\nInstead of Copilot floating everywhere, you can:\n\n- Limit financial agents to Finance channels\n- Restrict HR agents to labeled policy libraries\n- Prevent agents from responding in unmanaged chats\n\nThink of Teams as the **air traffic control tower for AI**.\n\n### Copilot in Meetings—Without Permanent Recordings\n\nOne of the most impactful updates is **Copilot in meetings without requiring stored transcripts or recordings**.\n\nWhy this matters:\n\n- Reduced privacy risk\n- Lower compliance overhead\n- No long-term storage of sensitive conversations\n\nCopilot can:\n\n- Generate live summaries\n- Track action items\n- Answer contextual questions\n\n…all without creating a permanent compliance artifact unless you choose to.\n\nThis is privacy-first AI done right.\n\n### Integration Patterns: Teams-First vs Hybrid\n\nTwo dominant patterns are emerging:\n\n**Teams-First Model**\n\n- Internal helpdesks\n- HR and IT support\n- Knowledge-based Q&A\n\n**Hybrid Model**\n\n- External systems (ServiceNow, Jira, Salesforce)\n- Teams as the conversational interface\n- Data remains in source systems\n\nChoosing the right model depends on data sensitivity and workflow maturity—but Teams remains the front door.\n\n## Phase 3: Declarative Agents Built on SharePoint Knowledge\n\nThis is the real “secret sauce” of the agentic intranet.\n\n### What Are Declarative Agents?\n\nDeclarative agents are **purpose-built Copilot agents** scoped to:\n\n- Specific SharePoint sites\n- Document libraries\n- Folders or labeled content\n\nUnlike generic Copilot, they:\n\n- Don’t hallucinate across the tenant\n- Operate within explicit knowledge boundaries\n- Deliver consistent, auditable answers\n\nThis is how you make Copilot *understand your business*.\n\n### The 5-Minute Agent: A Practical Walkthrough\n\nUsing **Copilot Studio Lite**, you can:\n\n1. Select a SharePoint library (e.g., “Project Alpha”)\n2. Define the agent’s role (e.g., Project Analyst)\n3. Restrict responses to approved documents only\n4. Publish directly into Teams\n\nResult:\n\n- An agent that answers questions like:\n- “What are the current risks?”\n- “What changed since last week?”\n- “Which milestones are overdue?”\n\nNo code. No plugins. Just clean SharePoint architecture.\n\n### Graph Connectors: Completing the Knowledge Picture\n\nMost businesses don’t live entirely in M365.\n\n**Microsoft Graph Connectors** allow Copilot to safely ingest:\n\n- Salesforce opportunities\n- Jira issues\n- ServiceNow tickets\n- Custom line-of-business systems\n\nThe key is governance:\n\n- Map external data to sensitivity labels\n- Control which agents can see it\n- Maintain audit trails\n\nWhen done correctly, Copilot doesn’t just answer questions—it understands *context across systems*.\n\n## Phase 4: Measuring ROI and Enforcing Governance\n\nAI without metrics is hype. AI with governance is sustainable.\n\n### Proving Value with the Copilot Dashboard\n\nThe **Copilot Dashboard in the M365 Admin Center** gives you:\n\n- Minutes saved per user\n- Feature adoption trends\n- Agent usage analytics\n\nThis enables real business math:\n\n- License cost vs. productivity gain\n- High-impact roles vs. low-value use cases\n- Data to justify expansion—or restraint\n\n### Baseline Security Mode: Reducing Legacy Risk\n\nFinally, apply Microsoft’s **Baseline Security Mode** across:\n\n- Office apps\n- SharePoint\n- Teams\n\nThis eliminates:\n\n- Legacy authentication risks\n- Inconsistent tenant configurations\n- Hidden exposure that AI can amplify\n\nAgentic AI magnifies *both* good and bad architecture. Baselines ensure the amplification works in your favor.\n\nThe modern intranet is no longer a collection of pages. It is a **living, reasoning system**.\n\nOrganizations that rush Copilot without cleaning permissions will struggle with trust, compliance, and fear. Organizations that embrace the agentic intranet—securely, intentionally, and measurably—will unlock something far more powerful than chatbots.\n\n### Share this:\n\n- [Click to share on Facebook (Opens in new window) Facebook](https://dellenny.com/the-agentic-intranet-securing-and-scaling-m365-copilot-with-sharepoint-teams/?share=facebook)\n- [Click to share on X (Opens in new window) X](https://dellenny.com/the-agentic-intranet-securing-and-scaling-m365-copilot-with-sharepoint-teams/?share=x)\n- [Click to share on LinkedIn (Opens in new window) LinkedIn](https://dellenny.com/the-agentic-intranet-securing-and-scaling-m365-copilot-with-sharepoint-teams/?share=linkedin)\n- [Click to share on Telegram (Opens in new window) Telegram](https://dellenny.com/the-agentic-intranet-securing-and-scaling-m365-copilot-with-sharepoint-teams/?share=telegram)\n- [Click to share on WhatsApp (Opens in new window) WhatsApp](https://dellenny.com/the-agentic-intranet-securing-and-scaling-m365-copilot-with-sharepoint-teams/?share=jetpack-whatsapp)\n-\n\n### Like this:\n\nLike Loading...\n\n### *Related*\n\n### Discover more from Dellenny\n\nSubscribe to get the latest posts sent to your email.\n\n[Subscribe](https://dellenny.com/?post_type=post&#038;p=3927)\n\nTags:[Artificial Intelligence](https://dellenny.com/tag/artificial-intelligence-2/ \"Artificial Intelligence\")[M365 Copilot](https://dellenny.com/tag/m365-copilot/ \"M365 Copilot\")[Microsoft 365](https://dellenny.com/tag/microsoft-365-2/ \"Microsoft 365\")[SharePoint](https://dellenny.com/tag/sharepoint/ \"SharePoint\")\n\n[previousHow To Use Sensitivity Labels in Microsoft Teams (Step-by-Step Guide)](https://dellenny.com/how-to-use-sensitivity-labels-in-microsoft-teams-step-by-step-guide/)\n\n## Leave a Reply\n\nYou must be [logged in](https://dellenny.com/wp-login.php?redirect_to=https%3A%2F%2Fdellenny.com%2Fthe-agentic-intranet-securing-and-scaling-m365-copilot-with-sharepoint-teams%2F) to post a comment.\n\n[Subscribe](https://dellenny.com/?post_type=post&#038;p=3927)\n\n%d",
  "PubDate": "2025-12-22T10:59:39+00:00",
  "Link": "https://dellenny.com/the-agentic-intranet-securing-and-scaling-m365-copilot-with-sharepoint-teams/"
}
