{
  "ProcessedDate": "2025-08-05 09:47:31",
  "FeedUrl": "https://hiddedesmet.com/feed.xml",
  "EnhancedContent": "Search for Blog\n\n[Terraform](/tags#Terraform)\n\n[GitHub](/tags#GitHub)\n\n[CI/CD](/tags#CI/CD)\n\n[Azure](/tags#Azure)\n\n[IaC](/tags#IaC)\n\n• Jun 16, 2025\n\n•\n\n17 min read\n\n# From simple to sophisticated: Terraform infrastructure evolution\n\nHow I transformed a basic Terraform configuration into a sophisticated infrastructure-as-code solution with modules, testing, CI/CD, and governance.\n\n[!\\[Hidde de Smet\\]()](/hidde)\n\nWritten by [Hidde de Smet](/hidde)\n\n- https://twitter.com/intent/tweet?text=From%20simple%20to%20sophisticated:%20Terraform%20infrastructure%20evolution&url=https://hiddedesmet.com/terraform-evolution\n- https://www.facebook.com/sharer/sharer.php?u=https://hiddedesmet.com/terraform-evolution\n- http://pinterest.com/pin/create/button/?url=https://hiddedesmet.com/terraform-evolution&amp;media=https://hiddedesmet.com/images/terraform-evolution.png&amp;description=From%20simple%20to%20sophisticated:%20Terraform%20infrastructure%20evolution\n- https://www.linkedin.com/shareArticle?mini=true&url=https://hiddedesmet.com/terraform-evolution&title=From%20simple%20to%20sophisticated:%20Terraform%20infrastructure%20evolution&summary=How%20I%20transformed%20a%20basic%20Terraform%20configuration%20into%20a%20sophisticated%20infrastructure-as-code%20solution%20with%20modules,%20testing,%20CI/CD,%20and%20governance.&source=myblog\n\n![From simple to sophisticated: Terraform infrastructure evolution]()\n\n## Table of Contents\n\n1. The starting point: simple but limited\n1. Version 0.1.0: The basic foundation\n2. Evolution phase 1: breaking down the monolith\n1. Version 0.2.0: Modular architecture\n3. Evolution phase 2: standardization and governance\n1. Version 0.3.0: Naming conventions and environment separation\n2. Version 0.4.0: Validation and comprehensive tagging\n4. Workspace vs environment separation strategies\n1. Strategy 1: Terraform workspaces (my initial approach)\n2. Strategy 2: Separate directories (current recommendation)\n5. Evolution phase 3: automation and CI/CD\n1. Version 0.5.0: GitHub Actions integration\n6. Evolution phase 4: comprehensive testing\n1. Version 0.6.0: Terratest implementation\n7. The advanced features: beyond the basics\n1. Current state: enterprise-ready infrastructure\n2. Alternative approaches: staying within your existing tool stack\n8. Key lessons learned\n1. 1. Start simple, evolve systematically\n2. 2. Governance is not optional\n3. 3. Testing infrastructure code is critical\n4. 4. Automation pays dividends\n5. 5. Documentation drives adoption\n9. What’s next: the roadmap ahead\n10. Getting Started: Your evolution path\n11. Conclusion: evolution over revolution\n\nWhen preparing samples for a Terraform training I was giving, I wanted to demonstrate how infrastructure code can evolve from simple beginnings through incremental improvements. Rather than starting with a complex example, I decided to build a project that shows the natural progression most teams experience, beginning with basic functionality and gradually adding sophisticated features like testing, automation, and governance.\n\nThis post shares the insights and lessons learned from creating those training samples. It’s designed to help teams understand not just the “what” but the “why” behind each improvement, providing a roadmap for elevating your own Terraform practices. Whether you’re just starting with Infrastructure as Code or looking to mature your existing setup, this evolution demonstrates practical steps you can take to build more reliable, maintainable infrastructure.\n\n## The starting point: simple but limited\n\nMy initial Terraform configuration was straightforward but had significant limitations that became apparent as the needs grew:\n\n### Version 0.1.0: The basic foundation\n\nI started with a monolithic `main.tf` file containing all the Azure resources:\n\n- Resource Group\n- Virtual Network and Subnet\n- Network Security Group\n- Storage Account and Container\n- App Service Plan and Linux Web App\n- Key Vault\n\n**The pain points:**\n\n- Single massive file with all resources\n- No reusability across environments\n- Manual deployment process prone to errors\n- No standardized naming conventions\n- Limited documentation and change tracking\n\nWhile this got me started quickly, I knew it wouldn’t scale as the infrastructure requirements grew.\n\n## Evolution phase 1: breaking down the monolith\n\n### Version 0.2.0: Modular architecture\n\nThe first major change was breaking the monolithic configuration into logical, reusable modules:\n\n``` modules/ ├── network/ # VNet, subnet, NSG ├── storage/ # Storage account and containers ├── webapp/ # App Service Plan and Web App └── keyvault/ # Key Vault resources\n\n```\n\n**Key improvements:**\n\n- **Reusability**: Modules could be used across multiple environments\n- **Maintainability**: Isolated components for easier debugging\n- **Collaboration**: Teams could work on different modules simultaneously\n- **Testing**: Individual modules could be tested in isolation\n\n**Lesson learned:** Modularization from the start saves significant refactoring time later. Even if you’re starting small, think about logical boundaries for your resources.\n\n## Evolution phase 2: standardization and governance\n\n### Version 0.3.0: Naming conventions and environment separation\n\nAs the infrastructure grew, inconsistent naming became a problem. I implemented:\n\n- **Naming module**: Standardized patterns for all Azure resources\n- **Environment separation**: Dedicated `dev.tfvars`\nand `prod.tfvars` files\n- **Terraform workspaces**: Proper state separation between environments\n\nHere’s how the naming module evolved to handle Azure’s complex naming requirements:\n\n```\n# modules/naming/main.tf\nlocals {\n# Resource abbreviations following Azure CAF\nresource_type_abbreviations = { resource_group = \"rg\" virtual_network = \"vnet\" subnet = \"snet\" network_security_group = \"nsg\" storage_account = \"st\" storage_container = \"stcont\" app_service_plan = \"asp\" web_app = \"app\" key_vault = \"kv\" }\n\n# Standard naming pattern: prefix-abbreviation-environment-suffix\nresource_group_name = var.resource_group != \"\" ? var.resource_group : \"${var.prefix}-${local.resource_type_abbreviations.resource_group}-${var.environment}-${var.suffix}\" }\n\n# Special naming for storage accounts (no dashes, lowercase only)\nresource \"null_resource\" \"storage_account_name\" { triggers = { name = \"${var.prefix}st${var.environment}${var.suffix}\" } }\n\n# Special naming for containers (lowercase with hyphens allowed)\nresource \"null_resource\" \"storage_container_name\" { triggers = { name = lower(\"${var.prefix}-stcont-${var.environment}-${var.suffix}\") } }\n\n```\n\nExample usage in main configuration:\n\n```\n# main.tf\nmodule \"naming\" { source = \"./modules/naming\"\n\nprefix = var.prefix environment = local.environment suffix = var.suffix project_name = var.project_name }\n\nresource \"azurerm_resource_group\" \"main\" { name = module.naming.resource_group_name location = var.location tags = module.naming.common_tags }\n\n```\n\n### Version 0.4.0: Validation and comprehensive tagging\n\nI added two critical governance modules:\n\n**Validation module:**\n\n- Azure resource name compliance checks\n- Length constraints and character restrictions\n- Environment-specific validation rules\n\n```\n# modules/validation/main.tf\nlocals {\n# Maximum length validation for Azure resources\nmax_length = { resource_group_name = 90 storage_account_name = 24 key_vault_name = 24 web_app_name = 60 virtual_network_name = 64 subnet_name = 80 nsg_name = 80 storage_container_name = 63 app_service_plan_name = 40 }\n\n# Storage account specific validation (lowercase letters and numbers only)\nvalidate_storage_account_chars = can(regex(\"^[a-z0-9]+$\", var.storage_account_name))\n\n# Overall validation result\nis_valid = local.validate_resource_group_name && local.validate_storage_account_name && local.validate_storage_account_chars &&\n# ... other validations\n}\n\n```\n\n**Tagging module:**\n\n- Standardized tags across all resources (Environment, Owner, Cost Center)\n- Automatic timestamp and Terraform version tracking\n- Compliance with organizational tagging policies\n\n```\n# modules/tagging/main.tf\nlocals {\n# Standard tags applied to all resources\ncommon_tags = merge( var.custom_tags, { Environment = var.environment ManagedBy = \"terraform\" Project = var.project_name CostCenter = var.cost_center Owner = var.owner CreatedDate = formatdate(\"YYYY-MM-DD\", timestamp()) TerraformVersion = \"1.12.1\" } ) }\n\noutput \"tags\" { description = \"Common tags to be applied to all resources\" value = local.common_tags }\n\n```\n\n**Impact:** These changes transformed the infrastructure from ad-hoc deployments to a governed, auditable system that met enterprise requirements.\n\n## Workspace vs environment separation strategies\n\nOne of the critical decisions during the evolution was how to handle environment separation. I experimented with different approaches and learned valuable lessons about their trade-offs:\n\n### Strategy 1: Terraform workspaces (my initial approach)\n\n```\n# Environment switching with workspaces\nterraform workspace new dev terraform workspace new prod\n\n# Deploy to development\nterraform workspace select dev terraform apply -var-file=\"environments/dev.tfvars\"\n\n# Deploy to production\nterraform workspace select prod terraform apply -var-file=\"environments/prod.tfvars\"\n\n```\n\n**Pros:**\n\n- Simple to implement initially\n- Single codebase for all environments\n- Built-in Terraform feature\n\n**Cons:**\n\n- Shared state file increases blast radius\n- Human error risk when switching workspaces\n- Difficult to implement different approval workflows per environment\n- Limited isolation for security and compliance\n\n### Strategy 2: Separate directories (current recommendation)\n\n``` environments/ ├── dev/ │ ├── main.tf │ ├── variables.tf │ ├── terraform.tfvars │ └── backend.tf └── prod/ ├── main.tf ├── variables.tf ├── terraform.tfvars └── backend.tf\n\n```\n\n**Pros:**\n\n- Complete state isolation\n- Environment-specific configurations possible\n- Clear separation for CI/CD pipelines\n- Better security and access control\n\n**Cons:**\n\n- Code duplication between environments\n- More complex maintenance\n- Requires discipline to keep environments in sync\n\n**Key lesson:** Start with workspaces for simplicity, but plan migration to separate backends as security and compliance requirements grow.\n\n## Evolution phase 3: automation and CI/CD\n\n### Version 0.5.0: GitHub Actions integration\n\nManual deployment was becoming a bottleneck and risk. I implemented comprehensive CI/CD:\n\n**Branch-based strategy:**\n\n- `develop`\nbranch → Development environment\n- `main`\nbranch → Production environment\n- Feature branches → PR validation only\n\n**Security features:**\n\n- Azure Service Principal authentication\n- GitHub environment protection rules\n- Automated plan generation and review\n- Manual workflow dispatch for emergency operations\n\nHere’s the GitHub Actions workflow structure:\n\n```\n# .github/workflows/terraform-deploy.yml\nname: 'Terraform Deploy'\n\non: push: branches: [main, develop] pull_request: branches: [main, develop] workflow_dispatch: inputs: environment: description: 'Environment to deploy' required: true default: 'dev' type: choice options: [dev, prod] action: description: 'Terraform action to perform' required: true default: 'plan' type: choice options: [plan, apply, destroy]\n\nenv: TF_VERSION: '1.12.1' ARM_CLIENT_ID: ${{ secrets.AZURE_CLIENT_ID }} ARM_CLIENT_SECRET: ${{ secrets.AZURE_CLIENT_SECRET }} ARM_SUBSCRIPTION_ID: ${{ secrets.AZURE_SUBSCRIPTION_ID }} ARM_TENANT_ID: ${{ secrets.AZURE_TENANT_ID }}\n\njobs: terraform-check: name: 'Terraform Check' runs-on: ubuntu-latest\n\nsteps:\n- name: Checkout\nuses: actions/checkout@v4\n\n- name: Setup Terraform\nuses: hashicorp/setup-terraform@v3 with: terraform_version: ${{ env.TF_VERSION }}\n\n- name: Terraform Format Check\nrun: terraform fmt -check -recursive\n\n- name: Terraform Validation\nrun: | terraform init -backend=false terraform validate\n\n```\n\n**Before vs. after:**\n\n*Manual process:*\n\n``` terraform workspace select dev terraform init terraform plan -var-file=\"environments/dev.tfvars\" terraform apply -var-file=\"environments/dev.tfvars\"\n\n```\n\n*Automated process:*\n\n``` git checkout develop git add . git commit -m \"Update infrastructure configuration\" git push origin develop # Automatically deploys to dev\n\n```\n\n**Results:** Deployment time reduced from 20+ minutes of manual work to seconds of automated execution, with built-in approval workflows for production.\n\n## Evolution phase 4: comprehensive testing\n\n### Version 0.6.0: Terratest implementation\n\nTesting infrastructure code was the final major hurdle. I implemented a comprehensive testing framework using Terratest:\n\n**Test categories implemented:**\n\n1. **Validation tests** (&lt; 1 second): Fast syntax and configuration validation\n2. **Module tests** (&lt; 1 minute): Individual component isolation testing\n3. **Infrastructure tests** (&lt; 30 minutes): Full end-to-end deployment verification\n4. **Naming convention tests** (&lt; 1 second): Resource naming standard compliance\n\n**Development workflow enhancement:**\n\nI created a Makefile for standardized development:\n\n```\n# Makefile targets for development workflow\nmake test # Quick validation (recommended for TDD) make test-all # Complete test suite make test-modules # Individual module tests make test-infrastructure # Full deployment tests\n\n```\n\nHere’s an example of the Terratest implementation:\n\n``` // test/terraform_modules_test.go func TestNamingConventions(t *testing.T) { t.Parallel()\n\nterraformOptions := &terraform.Options{ TerraformDir: \"../modules/naming\", Vars: map[string]interface{}{ \"prefix\": \"test\", \"environment\": \"dev\", \"suffix\": \"001\", \"project_name\": \"terraform-course\", }, }\n\ndefer terraform.Destroy(t, terraformOptions) terraform.InitAndApply(t, terraformOptions)\n\n// Test resource group naming convention resourceGroupName := terraform.Output(t, terraformOptions, \"resource_group_name\") assert.Contains(t, resourceGroupName, \"test-rg-dev-001\")\n\n// Test storage account naming (no dashes, lowercase) storageAccountName := terraform.Output(t, terraformOptions, \"storage_account_name\") assert.Regexp(t, \"^[a-z0-9]+$\", storageAccountName) }\n\nfunc TestValidationModule(t *testing.T) { terraformOptions := &terraform.Options{ TerraformDir: \"../modules/validation\", Vars: map[string]interface{}{ \"storage_account_name\": \"invalidSTORAGEname123!\", // Should fail }, }\n\n// Test that validation catches invalid names _, err := terraform.InitAndPlanE(t, terraformOptions) assert.Error(t, err, \"Expected validation to fail for invalid storage account name\") }\n\n```\n\n**Real-world impact:** During testing implementation, we discovered and fixed Azure storage container naming compliance issues that would have caused production failures.\n\n## The advanced features: beyond the basics\n\n### Current state: enterprise-ready infrastructure\n\nThe latest iteration includes advanced features that provide a foundation for enterprise-level operations:\n\n**Policy as code:**\n\n- OPA policy definitions for security and tagging compliance\n- Python script for validating Terraform plans against policies\n- Security policies for storage accounts and key vaults\n\n```\n# Example from policies/security.rego\npackage terraform.security\n\n# Ensure storage accounts use secure transfer\ndeny[msg] { resource := tfplan.root_module.resources[_] resource.type == \"azurerm_storage_account\" not resource.values.enable_https_traffic_only\n\nmsg := sprintf( \"Storage account %s must have enable_https_traffic_only set to true\", [resource.address] ) }\n\n```\n\n**Cost management foundation:**\n\n- Python script for generating cost estimates using Infracost integration\n- Framework for cost reporting and historical tracking\n- Baseline for optimization recommendations\n\n**Infrastructure monitoring tools:**\n\n- Drift detection script that compares Terraform state with actual Azure resources\n- Email notification framework for configuration changes\n- Reports generated in markdown format for easy review\n\n```\n# Example from scripts/drift_detection.py\ndef detect_drift(terraform_dir, output_dir): \"\"\"Detect drift between Terraform state and actual infrastructure.\"\"\"\n\n# Run terraform plan to detect drift\nsubprocess.run( [\"terraform\", \"-chdir=\" + terraform_dir, \"plan\", \"-detailed-exitcode\"], check=False # Don't fail on drift detection )\n\n```\n\n### Alternative approaches: staying within your existing tool stack\n\nWhile the Python scripts provide comprehensive functionality, they do introduce another tool stack. Here are alternatives that use tools you likely already have:\n\n**Policy validation alternatives:**\n\n```\n# Use native Terraform validation\nterraform plan -detailed-exitcode terraform validate\n\n# Use Checkov for policy scanning (single binary)\ncheckov -f main.tf --framework terraform\n\n```\n\n**Cost estimation without Python:**\n\n```\n# Use Infracost CLI directly in CI/CD\ninfracost breakdown --path . --format json > cost-estimate.json\n\n# Or use Azure CLI for basic cost queries\naz consumption usage list --top 10\n\n```\n\n**Drift detection with shell scripts:**\n\n``` #!/bin/bash\n# Simple drift detection using Terraform exit codes\nterraform plan -detailed-exitcode -no-color > drift-report.txt exit_code=$?\n\nif [ $exit_code -eq 2 ]; then echo \"⚠️ Drift detected - see drift-report.txt\"\n# Send notification using existing tools (curl, mail, etc.)\nfi\n\n```\n\n**GitHub Actions for automation:**\n\n```\n# Policy validation in CI without Python\n- name: Run Checkov\nuses: bridgecrewio/checkov-action@master with: framework: terraform\n\n- name: Cost estimation\nuses: infracost/infracost-gh-action@master with: api-key: ${{ secrets.INFRACOST_API_KEY }}\n\n```\n\n**Key consideration:** Start with the simplest approach that meets your needs. You can always evolve to more sophisticated tooling as requirements grow.\n\n**Documentation:**\n\n- Architecture Decision Records (ADRs) for design decisions\n- Automated diagram generation from Terraform code\n- Comprehensive module documentation with examples\n\n## Key lessons learned\n\n### 1. Start simple, evolve systematically\n\nYou don’t need to implement everything at once. The phased approach allowed me to:\n\n- Learn and adapt at each stage\n- Maintain working infrastructure throughout the evolution\n- Build team expertise gradually\n\n### 2. Governance is not optional\n\nWhat started as “nice to have” features like naming conventions and tagging became essential as I scaled:\n\n- Prevented configuration drift\n- Enabled cost tracking and optimization\n- Simplified troubleshooting and auditing\n\n### 3. Testing infrastructure code is critical\n\nInfrastructure failures are expensive and disruptive. My testing framework:\n\n- Catches issues before they reach production\n- Validates complex module interactions\n- Provides confidence for infrastructure changes\n\n### 4. Automation pays dividends\n\nThe initial investment in CI/CD automation provided:\n\n- Reduced deployment-related errors significantly\n- Major time savings on infrastructure operations\n- Improved security through consistent processes\n\n### 5. Documentation drives adoption\n\nComprehensive documentation, including upgrade guides and ADRs, provided:\n\n- Faster onboarding of new team members\n- Better decision-making through recorded rationale\n- Smoother handoffs and knowledge transfer\n\n## What’s next: the roadmap ahead\n\nMy infrastructure evolution continues with planned enhancements:\n\n**Short-term goals:**\n\n- Automate the policy validation in CI/CD pipeline\n- Integrate cost estimation with pull request workflows\n- Set up automated drift detection scheduling\n- Enhanced monitoring and alerting integration\n\n**Long-term vision:**\n\n- Fully automated policy enforcement with blocking rules\n- Real-time cost alerts and optimization recommendations\n- Self-healing infrastructure with automated drift remediation\n- Advanced security scanning integration (Checkov, tfsec)\n\n## Getting Started: Your evolution path\n\nIf you’re starting your own Terraform evolution, consider this roadmap:\n\n1. **Phase 1**: Start with basic functionality, but plan for modules\n2. **Phase 2**: Implement naming conventions and basic governance\n3. **Phase 3**: Add validation and comprehensive tagging\n4. **Phase 4**: Introduce CI/CD automation with branch protection\n5. **Phase 5**: Implement comprehensive testing with Terratest\n6. **Phase 6**: Add advanced features like policy enforcement and cost monitoring\n\n## Conclusion: evolution over revolution\n\nMy transformation from a simple Terraform script to a sophisticated infrastructure platform demonstrates that evolution often trumps revolution. By taking a systematic, phased approach, I:\n\n- Maintained working infrastructure throughout the process\n- Built team expertise and confidence gradually\n- Added value at each iteration\n- Created a foundation for future growth\n\nThe key is starting with your current needs while planning for future requirements. Your infrastructure code is a living system, expect it to evolve.\n\n[!\\[Hidde de Smet\\]()](/hidde)\n\nWritten by\n\n### [Hidde de Smet](/hidde)\n\nAs a certified Azure Solution Architect, I specialize in designing, implementing, and managing cloud-based solutions using Scrum and DevOps methodologies.\n\n### Start the conversation\n\n## Related\n\n[See all Terraform](/tags#Terraform)",
  "FeedLevelAuthor": "Hidde de Smet",
  "OutputDir": "_posts",
  "Tags": [
    "Azure",
    "CI/CD",
    "GitHub",
    "IaC",
    "Terraform"
  ],
  "Author": "Hidde de Smet",
  "FeedName": "Hidde de Smet's Blog",
  "Link": "https://hiddedesmet.com/terraform-evolution",
  "Description": "When preparing samples for a Terraform training I was giving, I wanted to demonstrate how infrastructure code can evolve from simple beginnings through incremental improvements. Rather than starting with a complex example, I decided to build a project that shows the natural progression most teams experience, beginning with basic functionality and gradually adding sophisticated features like testing, automation, and governance.\n\nThis post shares the insights and lessons learned from creating those training samples. It’s designed to help teams understand not just the “what” but the “why” behind each improvement, providing a roadmap for elevating your own Terraform practices. Whether you’re just starting with Infrastructure as Code or looking to mature your existing setup, this evolution demonstrates practical steps you can take to build more reliable, maintainable infrastructure.\n\n## The starting point: simple but limited\n\nMy initial Terraform configuration was straightforward but had significant limitations that became apparent as the needs grew:\n\n### Version 0.1.0: The basic foundation\n\nI started with a monolithic `main.tf` file containing all the Azure resources:\n\n- Resource Group\n- Virtual Network and Subnet\n- Network Security Group\n- Storage Account and Container\n- App Service Plan and Linux Web App\n- Key Vault\n\n**The pain points:**\n\n- Single massive file with all resources\n- No reusability across environments\n- Manual deployment process prone to errors\n- No standardized naming conventions\n- Limited documentation and change tracking\n\nWhile this got me started quickly, I knew it wouldn’t scale as the infrastructure requirements grew.\n\n## Evolution phase 1: breaking down the monolith\n\n### Version 0.2.0: Modular architecture\n\nThe first major change was breaking the monolithic configuration into logical, reusable modules:\n\n``` modules/ ├── network/ # VNet, subnet, NSG ├── storage/ # Storage account and containers ├── webapp/ # App Service Plan and Web App └── keyvault/ # Key Vault resources\n\n```\n\n**Key improvements:**\n\n- **Reusability**: Modules could be used across multiple environments\n- **Maintainability**: Isolated components for easier debugging\n- **Collaboration**: Teams could work on different modules simultaneously\n- **Testing**: Individual modules could be tested in isolation\n\n**Lesson learned:** Modularization from the start saves significant refactoring time later. Even if you’re starting small, think about logical boundaries for your resources.\n\n## Evolution phase 2: standardization and governance\n\n### Version 0.3.0: Naming conventions and environment separation\n\nAs the infrastructure grew, inconsistent naming became a problem. I implemented:\n\n- **Naming module**: Standardized patterns for all Azure resources\n- **Environment separation**: Dedicated `dev.tfvars`\nand `prod.tfvars` files\n- **Terraform workspaces**: Proper state separation between environments\n\nHere’s how the naming module evolved to handle Azure’s complex naming requirements:\n\n```\n# modules/naming/main.tf\nlocals {\n# Resource abbreviations following Azure CAF\nresource_type_abbreviations = { resource_group = \"rg\" virtual_network = \"vnet\" subnet = \"snet\" network_security_group = \"nsg\" storage_account = \"st\" storage_container = \"stcont\" app_service_plan = \"asp\" web_app = \"app\" key_vault = \"kv\" }\n\n# Standard naming pattern: prefix-abbreviation-environment-suffix\nresource_group_name = var.resource_group != \"\" ? var.resource_group : \"${var.prefix}-${local.resource_type_abbreviations.resource_group}-${var.environment}-${var.suffix}\" }\n\n# Special naming for storage accounts (no dashes, lowercase only)\nresource \"null_resource\" \"storage_account_name\" { triggers = { name = \"${var.prefix}st${var.environment}${var.suffix}\" } }\n\n# Special naming for containers (lowercase with hyphens allowed)\nresource \"null_resource\" \"storage_container_name\" { triggers = { name = lower(\"${var.prefix}-stcont-${var.environment}-${var.suffix}\") } }\n\n```\n\nExample usage in main configuration:\n\n```\n# main.tf\nmodule \"naming\" { source = \"./modules/naming\"\n\nprefix = var.prefix environment = local.environment suffix = var.suffix project_name = var.project_name }\n\nresource \"azurerm_resource_group\" \"main\" { name = module.naming.resource_group_name location = var.location tags = module.naming.common_tags }\n\n```\n\n### Version 0.4.0: Validation and comprehensive tagging\n\nI added two critical governance modules:\n\n**Validation module:**\n\n- Azure resource name compliance checks\n- Length constraints and character restrictions\n- Environment-specific validation rules\n\n```\n# modules/validation/main.tf\nlocals {\n# Maximum length validation for Azure resources\nmax_length = { resource_group_name = 90 storage_account_name = 24 key_vault_name = 24 web_app_name = 60 virtual_network_name = 64 subnet_name = 80 nsg_name = 80 storage_container_name = 63 app_service_plan_name = 40 }\n\n# Storage account specific validation (lowercase letters and numbers only)\nvalidate_storage_account_chars = can(regex(\"^[a-z0-9]+$\", var.storage_account_name))\n\n# Overall validation result\nis_valid = local.validate_resource_group_name && local.validate_storage_account_name && local.validate_storage_account_chars &&\n# ... other validations\n}\n\n```\n\n**Tagging module:**\n\n- Standardized tags across all resources (Environment, Owner, Cost Center)\n- Automatic timestamp and Terraform version tracking\n- Compliance with organizational tagging policies\n\n```\n# modules/tagging/main.tf\nlocals {\n# Standard tags applied to all resources\ncommon_tags = merge( var.custom_tags, { Environment = var.environment ManagedBy = \"terraform\" Project = var.project_name CostCenter = var.cost_center Owner = var.owner CreatedDate = formatdate(\"YYYY-MM-DD\", timestamp()) TerraformVersion = \"1.12.1\" } ) }\n\noutput \"tags\" { description = \"Common tags to be applied to all resources\" value = local.common_tags }\n\n```\n\n**Impact:** These changes transformed the infrastructure from ad-hoc deployments to a governed, auditable system that met enterprise requirements.\n\n## Workspace vs environment separation strategies\n\nOne of the critical decisions during the evolution was how to handle environment separation. I experimented with different approaches and learned valuable lessons about their trade-offs:\n\n### Strategy 1: Terraform workspaces (my initial approach)\n\n```\n# Environment switching with workspaces\nterraform workspace new dev terraform workspace new prod\n\n# Deploy to development\nterraform workspace select dev terraform apply -var-file=\"environments/dev.tfvars\"\n\n# Deploy to production\nterraform workspace select prod terraform apply -var-file=\"environments/prod.tfvars\"\n\n```\n\n**Pros:**\n\n- Simple to implement initially\n- Single codebase for all environments\n- Built-in Terraform feature\n\n**Cons:**\n\n- Shared state file increases blast radius\n- Human error risk when switching workspaces\n- Difficult to implement different approval workflows per environment\n- Limited isolation for security and compliance\n\n### Strategy 2: Separate directories (current recommendation)\n\n``` environments/ ├── dev/ │ ├── main.tf │ ├── variables.tf │ ├── terraform.tfvars │ └── backend.tf └── prod/ ├── main.tf ├── variables.tf ├── terraform.tfvars └── backend.tf\n\n```\n\n**Pros:**\n\n- Complete state isolation\n- Environment-specific configurations possible\n- Clear separation for CI/CD pipelines\n- Better security and access control\n\n**Cons:**\n\n- Code duplication between environments\n- More complex maintenance\n- Requires discipline to keep environments in sync\n\n**Key lesson:** Start with workspaces for simplicity, but plan migration to separate backends as security and compliance requirements grow.\n\n## Evolution phase 3: automation and CI/CD\n\n### Version 0.5.0: GitHub Actions integration\n\nManual deployment was becoming a bottleneck and risk. I implemented comprehensive CI/CD:\n\n**Branch-based strategy:**\n\n- `develop`\nbranch → Development environment\n- `main`\nbranch → Production environment\n- Feature branches → PR validation only\n\n**Security features:**\n\n- Azure Service Principal authentication\n- GitHub environment protection rules\n- Automated plan generation and review\n- Manual workflow dispatch for emergency operations\n\nHere’s the GitHub Actions workflow structure:\n\n```\n# .github/workflows/terraform-deploy.yml\nname: 'Terraform Deploy'\n\non: push: branches: [main, develop] pull_request: branches: [main, develop] workflow_dispatch: inputs: environment: description: 'Environment to deploy' required: true default: 'dev' type: choice options: [dev, prod] action: description: 'Terraform action to perform' required: true default: 'plan' type: choice options: [plan, apply, destroy]\n\nenv: TF_VERSION: '1.12.1' ARM_CLIENT_ID: ${{ secrets.AZURE_CLIENT_ID }} ARM_CLIENT_SECRET: ${{ secrets.AZURE_CLIENT_SECRET }} ARM_SUBSCRIPTION_ID: ${{ secrets.AZURE_SUBSCRIPTION_ID }} ARM_TENANT_ID: ${{ secrets.AZURE_TENANT_ID }}\n\njobs: terraform-check: name: 'Terraform Check' runs-on: ubuntu-latest\n\nsteps:\n- name: Checkout\nuses: actions/checkout@v4\n\n- name: Setup Terraform\nuses: hashicorp/setup-terraform@v3 with: terraform_version: ${{ env.TF_VERSION }}\n\n- name: Terraform Format Check\nrun: terraform fmt -check -recursive\n\n- name: Terraform Validation\nrun: | terraform init -backend=false terraform validate\n\n```\n\n**Before vs. after:**\n\n*Manual process:*\n\n``` terraform workspace select dev terraform init terraform plan -var-file=\"environments/dev.tfvars\" terraform apply -var-file=\"environments/dev.tfvars\"\n\n```\n\n*Automated process:*\n\n``` git checkout develop git add . git commit -m \"Update infrastructure configuration\" git push origin develop # Automatically deploys to dev\n\n```\n\n**Results:** Deployment time reduced from 20+ minutes of manual work to seconds of automated execution, with built-in approval workflows for production.\n\n## Evolution phase 4: comprehensive testing\n\n### Version 0.6.0: Terratest implementation\n\nTesting infrastructure code was the final major hurdle. I implemented a comprehensive testing framework using Terratest:\n\n**Test categories implemented:**\n\n1. **Validation tests** (\n2. **Module tests** (\n3. **Infrastructure tests** (\n4. **Naming convention tests** (\n\n**Development workflow enhancement:**\n\nI created a Makefile for standardized development:\n\n```\n# Makefile targets for development workflow\nmake test # Quick validation (recommended for TDD) make test-all # Complete test suite make test-modules # Individual module tests make test-infrastructure # Full deployment tests\n\n```\n\nHere’s an example of the Terratest implementation:\n\n``` // test/terraform_modules_test.go func TestNamingConventions(t *testing.T) { t.Parallel()\n\nterraformOptions := &terraform.Options{ TerraformDir: \"../modules/naming\", Vars: map[string]interface{}{ \"prefix\": \"test\", \"environment\": \"dev\", \"suffix\": \"001\", \"project_name\": \"terraform-course\", }, }\n\ndefer terraform.Destroy(t, terraformOptions) terraform.InitAndApply(t, terraformOptions)\n\n// Test resource group naming convention resourceGroupName := terraform.Output(t, terraformOptions, \"resource_group_name\") assert.Contains(t, resourceGroupName, \"test-rg-dev-001\")\n\n// Test storage account naming (no dashes, lowercase) storageAccountName := terraform.Output(t, terraformOptions, \"storage_account_name\") assert.Regexp(t, \"^[a-z0-9]+$\", storageAccountName) }\n\nfunc TestValidationModule(t *testing.T) { terraformOptions := &terraform.Options{ TerraformDir: \"../modules/validation\", Vars: map[string]interface{}{ \"storage_account_name\": \"invalidSTORAGEname123!\", // Should fail }, }\n\n// Test that validation catches invalid names _, err := terraform.InitAndPlanE(t, terraformOptions) assert.Error(t, err, \"Expected validation to fail for invalid storage account name\") }\n\n```\n\n**Real-world impact:** During testing implementation, we discovered and fixed Azure storage container naming compliance issues that would have caused production failures.\n\n## The advanced features: beyond the basics\n\n### Current state: enterprise-ready infrastructure\n\nThe latest iteration includes advanced features that provide a foundation for enterprise-level operations:\n\n**Policy as code:**\n\n- OPA policy definitions for security and tagging compliance\n- Python script for validating Terraform plans against policies\n- Security policies for storage accounts and key vaults\n\n```\n# Example from policies/security.rego\npackage terraform.security\n\n# Ensure storage accounts use secure transfer\ndeny[msg] { resource := tfplan.root_module.resources[_] resource.type == \"azurerm_storage_account\" not resource.values.enable_https_traffic_only\n\nmsg := sprintf( \"Storage account %s must have enable_https_traffic_only set to true\", [resource.address] ) }\n\n```\n\n**Cost management foundation:**\n\n- Python script for generating cost estimates using Infracost integration\n- Framework for cost reporting and historical tracking\n- Baseline for optimization recommendations\n\n**Infrastructure monitoring tools:**\n\n- Drift detection script that compares Terraform state with actual Azure resources\n- Email notification framework for configuration changes\n- Reports generated in markdown format for easy review\n\n```\n# Example from scripts/drift_detection.py\ndef detect_drift(terraform_dir, output_dir): \"\"\"Detect drift between Terraform state and actual infrastructure.\"\"\"\n\n# Run terraform plan to detect drift\nsubprocess.run( [\"terraform\", \"-chdir=\" + terraform_dir, \"plan\", \"-detailed-exitcode\"], check=False # Don't fail on drift detection )\n\n```\n\n### Alternative approaches: staying within your existing tool stack\n\nWhile the Python scripts provide comprehensive functionality, they do introduce another tool stack. Here are alternatives that use tools you likely already have:\n\n**Policy validation alternatives:**\n\n```\n# Use native Terraform validation\nterraform plan -detailed-exitcode terraform validate\n\n# Use Checkov for policy scanning (single binary)\ncheckov -f main.tf --framework terraform\n\n```\n\n**Cost estimation without Python:**\n\n```\n# Use Infracost CLI directly in CI/CD\ninfracost breakdown --path . --format json > cost-estimate.json\n\n# Or use Azure CLI for basic cost queries\naz consumption usage list --top 10\n\n```\n\n**Drift detection with shell scripts:**\n\n``` #!/bin/bash\n# Simple drift detection using Terraform exit codes\nterraform plan -detailed-exitcode -no-color > drift-report.txt exit_code=$?\n\nif [ $exit_code -eq 2 ]; then echo \"⚠️ Drift detected - see drift-report.txt\"\n# Send notification using existing tools (curl, mail, etc.)\nfi\n\n```\n\n**GitHub Actions for automation:**\n\n```\n# Policy validation in CI without Python\n- name: Run Checkov\nuses: bridgecrewio/checkov-action@master with: framework: terraform\n\n- name: Cost estimation\nuses: infracost/infracost-gh-action@master with: api-key: ${{ secrets.INFRACOST_API_KEY }}\n\n```\n\n**Key consideration:** Start with the simplest approach that meets your needs. You can always evolve to more sophisticated tooling as requirements grow.\n\n**Documentation:**\n\n- Architecture Decision Records (ADRs) for design decisions\n- Automated diagram generation from Terraform code\n- Comprehensive module documentation with examples\n\n## Key lessons learned\n\n### 1. Start simple, evolve systematically\n\nYou don’t need to implement everything at once. The phased approach allowed me to:\n\n- Learn and adapt at each stage\n- Maintain working infrastructure throughout the evolution\n- Build team expertise gradually\n\n### 2. Governance is not optional\n\nWhat started as “nice to have” features like naming conventions and tagging became essential as I scaled:\n\n- Prevented configuration drift\n- Enabled cost tracking and optimization\n- Simplified troubleshooting and auditing\n\n### 3. Testing infrastructure code is critical\n\nInfrastructure failures are expensive and disruptive. My testing framework:\n\n- Catches issues before they reach production\n- Validates complex module interactions\n- Provides confidence for infrastructure changes\n\n### 4. Automation pays dividends\n\nThe initial investment in CI/CD automation provided:\n\n- Reduced deployment-related errors significantly\n- Major time savings on infrastructure operations\n- Improved security through consistent processes\n\n### 5. Documentation drives adoption\n\nComprehensive documentation, including upgrade guides and ADRs, provided:\n\n- Faster onboarding of new team members\n- Better decision-making through recorded rationale\n- Smoother handoffs and knowledge transfer\n\n## What’s next: the roadmap ahead\n\nMy infrastructure evolution continues with planned enhancements:\n\n**Short-term goals:**\n\n- Automate the policy validation in CI/CD pipeline\n- Integrate cost estimation with pull request workflows\n- Set up automated drift detection scheduling\n- Enhanced monitoring and alerting integration\n\n**Long-term vision:**\n\n- Fully automated policy enforcement with blocking rules\n- Real-time cost alerts and optimization recommendations\n- Self-healing infrastructure with automated drift remediation\n- Advanced security scanning integration (Checkov, tfsec)\n\n## Getting Started: Your evolution path\n\nIf you’re starting your own Terraform evolution, consider this roadmap:\n\n1. **Phase 1**: Start with basic functionality, but plan for modules\n2. **Phase 2**: Implement naming conventions and basic governance\n3. **Phase 3**: Add validation and comprehensive tagging\n4. **Phase 4**: Introduce CI/CD automation with branch protection\n5. **Phase 5**: Implement comprehensive testing with Terratest\n6. **Phase 6**: Add advanced features like policy enforcement and cost monitoring\n\n## Conclusion: evolution over revolution\n\nMy transformation from a simple Terraform script to a sophisticated infrastructure platform demonstrates that evolution often trumps revolution. By taking a systematic, phased approach, I:\n\n- Maintained working infrastructure throughout the process\n- Built team expertise and confidence gradually\n- Added value at each iteration\n- Created a foundation for future growth\n\nThe key is starting with your current needs while planning for future requirements. Your infrastructure code is a living system, expect it to evolve.",
  "Title": "From simple to sophisticated: Terraform infrastructure evolution",
  "PubDate": "2025-06-16T05:00:00+00:00"
}
