{
  "ProcessedDate": "2025-08-05 09:47:20",
  "FeedUrl": "https://hiddedesmet.com/feed.xml",
  "EnhancedContent": "Search for Blog\n\n[infrastructure](/tags#infrastructure)\n\n[azure](/tags#azure)\n\n[terraform](/tags#terraform)\n\n[bicep](/tags#bicep)\n\n[opentofu](/tags#opentofu)\n\n[iac](/tags#iac)\n\n[devops](/tags#devops)\n\n[cloud](/tags#cloud)\n\n[ibm](/tags#ibm)\n\n‚Ä¢ Jun 22, 2025\n\n‚Ä¢\n\n21 min read\n\n# Bicep vs Terraform vs OpenTofu: Your Infrastructure as Code options in 2025\n\nA comprehensive comparison of Azure Bicep and Terraform, plus OpenTofu as a community-driven open source alternative. With HashiCorp's license changes and IBM's acquisition, which tool should you choose for your cloud infrastructure needs?\n\n[!\\[Hidde de Smet\\]()](/hidde)\n\nWritten by [Hidde de Smet](/hidde)\n\n- https://twitter.com/intent/tweet?text=Bicep%20vs%20Terraform%20vs%20OpenTofu:%20Your%20Infrastructure%20as%20Code%20options%20in%202025&url=https://hiddedesmet.com/bicep-vs-terraform-the-iac-showdown\n- https://www.facebook.com/sharer/sharer.php?u=https://hiddedesmet.com/bicep-vs-terraform-the-iac-showdown\n- http://pinterest.com/pin/create/button/?url=https://hiddedesmet.com/bicep-vs-terraform-the-iac-showdown&amp;media=https://hiddedesmet.com/images/bicep-vs-terraform.png&amp;description=Bicep%20vs%20Terraform%20vs%20OpenTofu:%20Your%20Infrastructure%20as%20Code%20options%20in%202025\n- https://www.linkedin.com/shareArticle?mini=true&url=https://hiddedesmet.com/bicep-vs-terraform-the-iac-showdown&title=Bicep%20vs%20Terraform%20vs%20OpenTofu:%20Your%20Infrastructure%20as%20Code%20options%20in%202025&summary=A%20comprehensive%20comparison%20of%20Azure%20Bicep%20and%20Terraform,%20plus%20OpenTofu%20as%20a%20community-driven%20open%20source%20alternative.%20With%20HashiCorp\n\n![Bicep vs Terraform vs OpenTofu: Your Infrastructure as Code options in 2025]()\n\n## Table of Contents\n\n1. Quick comparison overview\n2. Understanding the fundamental differences\n3. Syntax and developer experience: First impressions matter\n1. Bicep: Clarity through simplicity\n2. Terraform: Consistency across clouds\n4. Cloud coverage: Scope vs. depth\n1. Bicep: Azure excellence\n2. Terraform: Multi-cloud mastery\n5. State management: Different approaches, different trade-offs\n1. Bicep: Azure-managed state\n2. Terraform: Explicit state control\n6. Real-world performance and reliability\n1. Deployment speed\n2. Error handling and debugging\n7. Best practices I‚Äôve learned\n1. Choosing Bicep for Azure-native excellence\n2. Choosing Terraform for multi-cloud flexibility\n8. Learning curve considerations\n1. Bicep: Easier for Azure developers\n2. Terraform: More complex but worthwhile\n9. Cost considerations beyond licensing\n10. Team and organizational factors\n1. Why team dynamics matter more than technical features\n2. Skill development and career considerations\n11. Advanced use cases\n1. Large-scale deployments\n2. GitOps and CI/CD integration\n12. My recommendation framework\n1. Choose Bicep if:\n2. Choose Terraform if:\n3. Choose OpenTofu if:\n13. Decision flowchart\n1. A practical hybrid approach\n14. Future developments\n1. What‚Äôs next for Bicep\n2. What‚Äôs next for Terraform\n15. The IBM acquisition factor\n1. Potential benefits\n2. Potential concerns\n3. What this means for your decision\n4. The OpenTofu alternative\n16. What about other IaC tools?\n17. Final thoughts\n18. üìã Key takeaways\n\nThe Infrastructure as Code (IaC) landscape has evolved dramatically over the past few years, with organizations increasingly adopting declarative approaches to manage their cloud resources. Two prominent players have emerged as frontrunners in this space: **Azure Bicep** and **HashiCorp Terraform**. Recently, **OpenTofu** has joined as a community-driven fork of Terraform, offering the same capabilities under open-source governance. While all these tools aim to solve the same fundamental problem (provisioning and managing infrastructure through code), they take different approaches to governance and platform focus.\n\nAfter working extensively with both Bicep and Terraform across various projects and cloud environments, I‚Äôve developed strong opinions about when to use each. This isn‚Äôt just another feature comparison; it‚Äôs a practical guide based on real-world experience, complete with examples, best practices, and honest assessments of each tool‚Äôs strengths and weaknesses, plus insights on when OpenTofu might be the right choice.\n\n## Quick comparison overview\n\n| Aspect | Bicep | Terraform | OpenTofu | | --- | --- | --- | --- | | **Cloud Support** | Azure only | Multi-cloud | Multi-cloud (same as Terraform) | | **Learning Curve** | Gentle (for Azure devs) | Moderate | Identical to Terraform | | **State Management** | Azure-managed | Manual/Remote | Manual/Remote (same as Terraform) | | **Syntax** | Clean, intuitive | Verbose but consistent | Identical to Terraform | | **Features** | Azure-focused | Full multi-cloud | Same feature set as Terraform | | **Community** | Growing | Large | Emerging (Terraform-compatible) | | **Vendor** | Microsoft | IBM (HashiCorp) | Linux Foundation | | **License** | MIT | MPL 2.0 | MPL 2.0 | | **Best For** | Azure-first teams | Multi-cloud environments | Open-source advocates who want Terraform |\n\n## Understanding the fundamental differences\n\nBefore diving into technical details, it‚Äôs important to understand the core philosophical differences between these tools:\n\n**Bicep** represents Microsoft‚Äôs vision of Azure-native infrastructure management. It‚Äôs designed specifically for Azure, embracing the platform‚Äôs unique characteristics and providing deep integration with Azure Resource Manager (ARM). Think of it as the ‚Äúnative son‚Äù approach: built by Azure, for Azure.\n\n**Terraform** embodies HashiCorp‚Äôs multi-cloud philosophy. It‚Äôs designed to be cloud-agnostic, treating all cloud providers as equals through its provider ecosystem. This is the ‚Äúuniversal translator‚Äù approach: one language to rule them all.\n\n**OpenTofu** is essentially Terraform with different governance. Since it‚Äôs a fork of Terraform, it shares identical syntax, features, and capabilities. The key difference is organizational: OpenTofu is managed by the Linux Foundation as a truly open-source project, while Terraform is now owned by IBM. From a technical standpoint, they‚Äôre virtually identical.\n\n## Syntax and developer experience: First impressions matter\n\n### Bicep: Clarity through simplicity\n\nBicep‚Äôs syntax feels refreshingly clean, especially if you‚Äôre coming from ARM templates. Here‚Äôs a simple storage account example:\n\n```bicep param location string = resourceGroup().location param storageAccountName string = 'mystorageacct${uniqueString(resourceGroup().id)}'\n\nresource storageAccount 'Microsoft.Storage/storageAccounts@2024-01-01' = { name: storageAccountName location: location sku: { name: 'Standard_LRS' } kind: 'StorageV2' properties: { accessTier: 'Hot' } }\n\noutput storageAccountKey string = storageAccount.listKeys().keys[0].value\n\n```\n\nThe beauty of Bicep syntax lies in its intuitive feel for Azure developers. Resource definitions read almost like natural language, while strong typing provides excellent IntelliSense support that makes development feel effortless. The automatic dependency management through symbolic references eliminates much of the complexity that comes with orchestrating infrastructure deployments.\n\n### Terraform: Consistency across clouds\n\nTerraform‚Äôs HCL (HashiCorp Configuration Language) syntax is more verbose but consistent across all providers:\n\n``` variable \"location\" { description = \"Azure region for resources\" type = string default = \"West Europe\" }\n\nvariable \"resource_group_name\" { description = \"Name of the resource group\" type = string }\n\nresource \"azurerm_storage_account\" \"example\" { name = \"mystorageacct${random_string.suffix.result}\" resource_group_name = var.resource_group_name location = var.location account_tier = \"Standard\" account_replication_type = \"LRS\" account_kind = \"StorageV2\"\n\naccess_tier = \"Hot\" }\n\nresource \"random_string\" \"suffix\" { length = 8 special = false upper = false }\n\noutput \"storage_account_key\" { value = azurerm_storage_account.example.primary_access_key sensitive = true }\n\n```\n\nTerraform‚Äôs strength lies in its consistency across providers and the rich ecosystem that has evolved around it. The same patterns and concepts apply whether you‚Äôre provisioning AWS EC2 instances, Azure storage accounts, or Kubernetes clusters. This consistency becomes invaluable when working across multiple platforms, though it comes at the cost of some Azure-specific optimizations.\n\n## Cloud coverage: Scope vs. depth\n\n### Bicep: Azure excellence\n\nBicep shines when you‚Äôre all-in on Azure. It supports:\n\n- **Every Azure service** from day one of public preview\n- **Latest API versions** immediately available\n- **Azure-specific features** like managed identities, KeyVault integration\n- **Native ARM template compatibility**\n\nThis tight integration means you‚Äôll never wait for a provider update to use the latest Azure features. When Azure releases a new service, Bicep can use it immediately.\n\n### Terraform: Multi-cloud mastery\n\nTerraform‚Äôs strength lies in its breadth:\n\n- **3,000+ providers** covering virtually every cloud and service\n- **Consistent workflows** across AWS, Azure, GCP, and others\n- **Hybrid deployments** managing on-premises and cloud resources together\n- **Third-party services** like DataDog, GitHub, Kubernetes resources\n\nIf you‚Äôre working in a multi-cloud environment or need to manage resources beyond pure cloud infrastructure, Terraform‚Äôs ecosystem is unmatched.\n\n## State management: Different approaches, different trade-offs\n\n### Bicep: Azure-managed state\n\nOne of Bicep‚Äôs most compelling features is **no local state files**. Azure Resource Manager handles all state management:\n\n| ‚úÖ**Advantages** | ‚ùå**Limitations** | | --- | --- | | No state file corruption or conflicts | Tied to Azure‚Äôs deployment model | | Natural team collaboration without state locking | Less flexibility for complex deployment scenarios | | Automatic cleanup of orphaned resources | Harder to manage resources across multiple Azure tenants | | Built-in what-if operations for change preview | Limited to Azure Resource Manager capabilities |\n\n### Terraform: Explicit state control\n\nTerraform‚Äôs state file approach provides fine-grained control:\n\n| ‚úÖ**Advantages** | ‚ö†Ô∏è**Challenges** | | --- | --- | | Complete visibility into managed resources | State file management complexity | | Support for import operations | Potential for state corruption | | Flexible backend options (S3, Azure Storage, Terraform Cloud) | Team collaboration requires careful state locking | | Powerful state manipulation commands | Manual cleanup of orphaned resources |\n\n## Real-world performance and reliability\n\n### Deployment speed\n\n> >\n> üí° **Key insight**: Bicep deployments are generally faster for Azure resources, particularly for complex scenarios involving multiple interdependent resources.\n> >\n\n**Why Bicep is faster:**\n\n- Direct ARM template compilation\n- Azure‚Äôs native orchestration\n- Optimized dependency resolution\n\nTerraform deployments can be slower, especially when managing large numbers of resources, but the gap has narrowed significantly with recent performance improvements.\n\n### Error handling and debugging\n\n> >\n> üîç **Pro tip**: Bicep provides superior error messages for Azure-specific issues. When something goes wrong, you get clear, actionable error messages that directly relate to Azure concepts.\n> >\n\nTerraform‚Äôs error messages can be more cryptic, particularly when dealing with provider-specific issues. However, Terraform‚Äôs plan output is generally more detailed for understanding what changes will be applied.\n\n## Best practices I‚Äôve learned\n\n### Choosing Bicep for Azure-native excellence\n\nBicep shines brightest when you‚Äôre building solutions that live and breathe Azure. If your organization has made the strategic decision to standardize on Microsoft‚Äôs cloud platform, Bicep offers a development experience that feels natural and intuitive. Teams already familiar with ARM templates will find the transition almost effortless, while newcomers appreciate how directly Bicep concepts map to Azure resources.\n\nThe immediate access to new Azure features is another compelling reason to choose Bicep. When Microsoft releases new services or capabilities, they‚Äôre available in Bicep on day one‚Äîno waiting for third-party providers to catch up. This can be crucial for organizations that want to leverage cutting-edge Azure capabilities as soon as they‚Äôre available.\n\n**Key scenarios where Bicep excels:**\n\n- Azure-first organizations looking to standardize on Microsoft tooling\n- Teams migrating from ARM templates seeking better syntax and tooling\n- Projects requiring immediate access to new Azure features\n- Development teams that prefer integrated Microsoft development experiences\n- Organizations wanting to minimize external dependencies and state management complexity\n\n```bicep // Example of a well-structured Bicep module param environmentName string param location string = resourceGroup().location\n\nvar tags = { Environment: environmentName ManagedBy: 'Bicep' CreatedDate: utcNow('yyyy-MM-dd') }\n\nmodule networking 'modules/networking.bicep' = { name: 'networking-deployment' params: { environmentName: environmentName location: location tags: tags } }\n\nmodule compute 'modules/compute.bicep' = { name: 'compute-deployment' params: { environmentName: environmentName location: location subnetId: networking.outputs.subnetId tags: tags } }\n\n```\n\n```bicep // Example of a well-structured Bicep module following best practices param environmentName string param location string = resourceGroup().location\n\nvar tags = { Environment: environmentName ManagedBy: 'Bicep' CreatedDate: utcNow('yyyy-MM-dd') }\n\nmodule networking 'modules/networking.bicep' = { name: 'networking-deployment' params: { environmentName: environmentName location: location tags: tags } }\n\nmodule compute 'modules/compute.bicep' = { name: 'compute-deployment' params: { environmentName: environmentName location: location subnetId: networking.outputs.subnetId tags: tags } }\n\n```\n\n### Choosing Terraform for multi-cloud flexibility\n\nTerraform becomes the clear winner when your infrastructure story extends beyond a single cloud provider. Whether you‚Äôre orchestrating resources across AWS, Azure, and Google Cloud, or integrating cloud services with on-premises infrastructure, Terraform‚Äôs provider ecosystem is unmatched. The consistent syntax and approach across all providers means your team can apply the same concepts and patterns regardless of the underlying platform.\n\nThe mature ecosystem surrounding Terraform is another significant advantage. With thousands of community-contributed modules, chances are someone has already solved the infrastructure challenge you‚Äôre facing. This can dramatically accelerate development time, though it‚Äôs important to thoroughly validate any modules you incorporate into your infrastructure.\n\nTerraform also offers more sophisticated state management capabilities, which becomes crucial as your infrastructure grows in complexity. The ability to manipulate state, import existing resources, and use advanced features like workspaces provides the flexibility needed for enterprise-scale deployments.\n\n**Terraform excels in these scenarios:**\n\n- Multi-cloud or hybrid cloud architectures requiring consistent tooling\n- Organizations with diverse infrastructure requirements spanning multiple providers\n- Teams that value large community ecosystems and extensive module libraries\n- Complex deployments requiring advanced state management and manipulation\n- Projects needing to integrate cloud resources with existing on-premises infrastructure\n\n```\n# Example of a well-structured Terraform configuration\nterraform { required_version = \">= 1.12.2\" required_providers { azurerm = { source = \"hashicorp/azurerm\" version = \"~> 4.34.0\" } }\n\nbackend \"azurerm\" { resource_group_name = \"terraform-state-rg\" storage_account_name = \"terraformstatestorage\" container_name = \"tfstate\" key = \"prod.terraform.tfstate\" } }\n\nvariable \"environment\" { description = \"The deployment environment\" type = string validation { condition = contains([\"dev\", \"staging\", \"prod\"], var.environment) error_message = \"Environment must be dev, staging, or prod.\" } }\n\nlocals { common_tags = { Environment = var.environment ManagedBy = \"Terraform\" Project = \"MyProject\" } }\n\nmodule \"networking\" { source = \"./modules/networking\"\n\nenvironment = var.environment tags = local.common_tags }\n\nmodule \"compute\" { source = \"./modules/compute\"\n\nenvironment = var.environment subnet_id = module.networking.subnet_id tags = local.common_tags }\n\n```\n\n## Learning curve considerations\n\n### Bicep: Easier for Azure developers\n\nIf you‚Äôre already working with Azure, **Bicep has a remarkably gentle learning curve**. The syntax is intuitive, the tooling is excellent, and the concepts map directly to Azure resources you already understand.\n\n**Time to productivity:** 1-2 weeks for basic competency, 1-2 months for advanced scenarios.\n\n### Terraform: More complex but worthwhile\n\nTerraform requires more upfront investment to understand concepts like providers, state, workspaces, and the HCL language itself. However, this investment pays dividends if you‚Äôre working across multiple platforms.\n\n**Time to productivity:** 2-4 weeks for basic competency, 2-3 months for advanced multi-cloud scenarios.\n\n## Cost considerations beyond licensing\n\nWhile both Bicep and Terraform are free to use, the total cost of ownership tells a more nuanced story. These costs extend far beyond software licensing to include learning curves, operational overhead, and long-term maintenance.\n\n**Bicep‚Äôs cost advantages stem from simplicity and integration.** Azure-focused teams can become productive faster, reducing the time and cost associated with training and onboarding. The elimination of state file management removes an entire category of operational complexity, reducing both infrastructure costs and the human effort required to maintain reliable deployments. For organizations already invested in Microsoft tooling, Bicep integrates seamlessly with existing development workflows, minimizing additional tool licensing and training costs.\n\n**Terraform‚Äôs costs are front-loaded but offer long-term flexibility benefits.** The initial learning investment is higher, especially for teams new to infrastructure as code concepts. State management requires additional infrastructure and operational processes, adding complexity and cost. However, these investments pay dividends in multi-cloud scenarios where Terraform‚Äôs consistency can actually reduce overall complexity compared to learning multiple cloud-specific tools.\n\nOrganizations should also consider the cost of potential vendor lock-in. While Bicep ties you to Azure, this might align perfectly with your business strategy. Terraform provides more flexibility but requires ongoing investment in maintaining multi-provider expertise.\n\n## Team and organizational factors\n\n### Why team dynamics matter more than technical features\n\nThe choice between Bicep and Terraform often comes down to organizational context rather than pure technical merit. I‚Äôve seen technically superior solutions fail because they didn‚Äôt align with team capabilities, organizational culture, or long-term strategy.\n\n**Bicep succeeds when organizations embrace Azure-first thinking.** If your company has made the strategic decision to standardize on Microsoft technologies, choosing Bicep reinforces that decision and provides a more integrated development experience. Teams that already understand Azure concepts will be productive with Bicep much faster than learning Terraform‚Äôs abstractions.\n\n**Terraform thrives in organizations that value flexibility and want to avoid vendor lock-in.** Companies that operate in regulated industries, work with multiple cloud providers, or have complex hybrid environments often find Terraform‚Äôs provider ecosystem invaluable. The learning investment pays dividends when you need to manage resources across different platforms with consistent tooling.\n\nThe size and structure of your team also influences the decision. Smaller, Azure-focused teams often prefer Bicep‚Äôs simplicity and integration with Microsoft tooling. Larger organizations with dedicated infrastructure teams and diverse platform requirements typically benefit from Terraform‚Äôs flexibility and ecosystem.\n\n### Skill development and career considerations\n\nFrom a career development perspective, both tools offer valuable skills, but with different market dynamics. Terraform skills are more transferable across organizations and cloud providers, making it attractive for consultants and engineers who change roles frequently. Bicep expertise, while more specialized, is highly valued in Microsoft-centric organizations and can complement broader Azure architecture skills.\n\nConsider your team‚Äôs current expertise and career goals. If your developers are already deep in the Microsoft ecosystem, Bicep represents a natural progression. If your team works across multiple platforms or wants to maintain cloud-agnostic skills, Terraform provides broader market applicability.\n\n## Advanced use cases\n\n### Large-scale deployments\n\nFor large-scale Azure deployments, both tools handle complexity well, but differently:\n\n**Bicep excels at:**\n\n- Azure-specific resource relationships\n- Native ARM template integration\n- Immediate access to new Azure features\n\n**Terraform excels at:**\n\n- Cross-provider resource management\n- Complex data transformations\n- Advanced provisioning logic\n\n### GitOps and CI/CD integration\n\nBoth tools integrate well with modern DevOps practices:\n\n**Bicep CI/CD strengths:**\n\n- Native GitHub Actions integration\n- Azure DevOps built-in tasks\n- Simple artifact management (no state files)\n\n**Terraform CI/CD strengths:**\n\n- Mature ecosystem of CI/CD integrations\n- Terraform Cloud native workflows\n- Advanced plan and apply automation\n\n## My recommendation framework\n\nAfter years of working with both tools, here‚Äôs my decision framework:\n\n### Choose Bicep if:\n\n1. **You‚Äôre Azure-first**: 80%+ of your infrastructure is on Azure\n2. **You want simplicity**: Prefer fewer moving parts and concepts\n3. **You‚Äôre migrating from ARM**: Natural evolution path\n4. **You value immediate feature access**: Need latest Azure features ASAP\n\n### Choose Terraform if:\n\n1. **You‚Äôre multi-cloud**: Managing resources across multiple providers\n2. **You‚Äôre hybrid**: Mix of cloud and on-premises resources\n3. **You value ecosystem**: Want access to community modules and providers\n4. **You need flexibility**: Require advanced state management and automation\n\n### Choose OpenTofu if:\n\n1. **Open-source priority**: Community governance is important to you\n2. **Vendor independence**: Want to avoid corporate control\n3. **Terraform compatibility**: Need existing Terraform code to work\n4. **Long-term stability**: Prefer predictable licensing\n\n## Decision flowchart\n\n```mermaid flowchart TD A[Starting IaC Journey] --> B{Azure Only?} B -->|Yes| C{Team familiar with ARM?} B -->|No| D{Open Source Priority?}\n\nC -->|Yes| E[Choose Bicep] C -->|No| F{Want simplicity?} F -->|Yes| E F -->|No| G[Consider Terraform]\n\nD -->|Yes| H[Choose OpenTofu] D -->|No| I{IBM concerns?} I -->|Yes| H I -->|No| J[Choose Terraform]\n\nstyle E fill:#0078d4,color:#fff style H fill:#ff6b35,color:#fff style J fill:#623ce4,color:#fff\n\n```\n\n### A practical hybrid approach\n\nIn larger organizations, I‚Äôve seen successful implementations using **both tools**:\n\n- **Terraform for foundational infrastructure**: Networking, security, shared services\n- **Bicep for application-specific resources**: App Services, Functions, databases\n\nThis approach leverages each tool‚Äôs strengths while minimizing their weaknesses.\n\n## Future developments\n\nBoth tools are rapidly evolving:\n\n### What‚Äôs next for Bicep\n\n- Enhanced module ecosystem\n- Better multi-subscription deployment support\n- Improved testing and validation tools\n- Potential expansion beyond Azure (though unlikely)\n\n### What‚Äôs next for Terraform\n\n- Continued performance improvements\n- Enhanced cloud provider integrations\n- Better developer experience tools\n- Terraform Cloud feature expansion\n\n## The IBM acquisition factor\n\nIt‚Äôs impossible to discuss Terraform‚Äôs future without addressing the elephant in the room: IBM‚Äôs acquisition of HashiCorp in 2024. This major change brings both opportunities and concerns that organizations need to consider when making long-term IaC decisions.\n\n### Potential benefits\n\n- **Enterprise integration**: IBM‚Äôs enterprise focus could lead to better integration with existing enterprise tools and workflows\n- **Increased investment**: More resources for development and support\n- **Hybrid cloud expertise**: IBM‚Äôs hybrid cloud experience could enhance Terraform‚Äôs multi-cloud capabilities\n\n### Potential concerns\n\n- **Licensing changes**: History shows that acquisitions often lead to licensing model changes that could affect cost\n- **Product direction shifts**: IBM‚Äôs strategic priorities might influence Terraform‚Äôs roadmap in unexpected ways\n- **Community impact**: The open-source community‚Äôs relationship with the project could change under corporate ownership\n- **Vendor lock-in risks**: What was once a vendor-neutral tool is now owned by a cloud provider competitor\n\n### What this means for your decision\n\nIf you‚Äôre choosing between Bicep and Terraform today, the IBM acquisition adds a new variable to consider:\n\n- **For risk-averse organizations**: The uncertainty around Terraform‚Äôs future under IBM might make Bicep‚Äôs Microsoft backing more appealing for Azure-focused teams\n- **For multi-cloud strategies**: You‚Äôll want to monitor how IBM‚Äôs ownership affects Terraform‚Äôs neutrality across cloud providers\n- **For existing Terraform users**: Consider diversification strategies or at minimum, stay informed about licensing and product direction changes\n\nThe acquisition is still relatively recent, and its full implications won‚Äôt be clear for some time. However, it‚Äôs a reminder that no tool exists in a vacuum, and vendor relationships matter when making infrastructure decisions.\n\n### The OpenTofu alternative\n\nSpeaking of vendor concerns, it‚Äôs worth mentioning **OpenTofu**, the open-source fork of Terraform that emerged in response to HashiCorp‚Äôs licensing changes. Maintained by the Linux Foundation, OpenTofu is essentially Terraform with different governance - it shares the same syntax, features, and capabilities.\n\n**Why consider OpenTofu:**\n\n- **Identical to Terraform**: Same syntax, same providers, same state files - it‚Äôs a drop-in replacement\n- **True open source**: No vendor lock-in or licensing restrictions\n- **Community governance**: Managed by the Linux Foundation rather than a single company\n- **100% Terraform compatibility**: Existing Terraform configurations work without changes\n- **Active development**: Growing community and regular releases\n\n**Current considerations:**\n\n- **Smaller ecosystem**: Fewer third-party tools and resources compared to Terraform\n- **Provider timing**: Some providers may release updates for Terraform first, then OpenTofu\n- **Enterprise tooling**: Terraform Cloud ecosystem is more mature than OpenTofu alternatives\n\nFor organizations concerned about vendor control or licensing costs, OpenTofu adds a third path to consider alongside Bicep and Terraform. It‚Äôs particularly appealing if you value open-source principles and want to avoid potential future licensing surprises.\n\n## What about other IaC tools?\n\nWhile this post focuses on the declarative configuration language approach (Bicep, Terraform, OpenTofu), it‚Äôs worth acknowledging that other IaC paradigms exist:\n\n**Pulumi** takes a different approach entirely, using general-purpose programming languages (TypeScript, Python, Go, C#) instead of domain-specific languages. This appeals to developers who prefer familiar programming constructs like loops, conditionals, and functions over declarative configurations.\n\n**AWS CDK, Azure CDK for Terraform, and similar tools** also use programming languages but compile to other IaC formats (CloudFormation, Terraform) rather than running directly.\n\nThese imperative approaches have their own trade-offs around testability, debugging, and team collaboration that deserve a dedicated comparison. For this post, I‚Äôve focused on the declarative DSL ecosystem since that‚Äôs where most organizations start their IaC journey.\n\n## Final thoughts\n\nChoosing between Bicep, Terraform, and OpenTofu isn‚Äôt just a technical decision. It‚Äôs a strategic one that affects your team‚Äôs productivity, your organization‚Äôs flexibility, and your long-term infrastructure management approach.\n\n**Bicep represents focused specialization**: deep, native integration with Azure that provides excellent developer experience and immediate access to Azure innovations. If you‚Äôre building on Azure and plan to stay there, Bicep‚Äôs focused approach pays dividends in team productivity and reduced complexity.\n\n**Terraform embodies flexible standardization**: one tool, one workflow, across all your infrastructure needs. If you‚Äôre in a multi-cloud world or value the flexibility to change direction, Terraform‚Äôs ecosystem and proven track record make it a reliable choice, though the IBM acquisition adds uncertainty.\n\n**OpenTofu offers open-source assurance**: for teams that prioritize community governance and want to avoid vendor dependencies, it provides Terraform compatibility without the corporate overhead.\n\nThe reality is that all these tools are excellent at what they do. The choice comes down to understanding your organization‚Äôs needs, constraints, risk tolerance, and long-term strategy. There‚Äôs no wrong choice here, only choices that are more or less aligned with your specific context.\n\nWhat matters most is picking one, learning it well, and building great infrastructure with it. The best IaC tool is the one your team actually uses effectively, not the one with the most features on paper.\n\n## üìã Key takeaways\n\n| Tool | Best for | Key advantage | Main concern | | --- | --- | --- | --- | | **üîµ Bicep** | Azure-focused teams | Native integration, no state files | Limited to Azure only | | **üü£ Terraform** | Multi-cloud environments | Mature ecosystem, broad provider support | IBM acquisition uncertainty | | **üü† OpenTofu** | Open-source advocates | Community governance, vendor independence | Smaller ecosystem |\n\n> >\n> üéØ **Bottom line**: Choose Bicep for Azure simplicity, Terraform for multi-cloud maturity, or OpenTofu for open-source peace of mind. All are solid choices when used appropriately.\n> >\n\n*What‚Äôs been your experience with Bicep and Terraform? I‚Äôd love to hear about your real-world usage patterns and any challenges you‚Äôve encountered. Share your thoughts in the comments below or reach out to me directly.*\n\n[!\\[Hidde de Smet\\]()](/hidde)\n\nWritten by\n\n### [Hidde de Smet](/hidde)\n\nAs a certified Azure Solution Architect, I specialize in designing, implementing, and managing cloud-based solutions using Scrum and DevOps methodologies.\n\n### Start the conversation\n\n## Related\n\n[See all infrastructure](/tags#infrastructure)",
  "FeedLevelAuthor": "Hidde de Smet",
  "OutputDir": "_posts",
  "Tags": [
    "azure",
    "bicep",
    "cloud",
    "devops",
    "iac",
    "ibm",
    "infrastructure",
    "opentofu",
    "terraform"
  ],
  "Author": "Hidde de Smet",
  "FeedName": "Hidde de Smet's Blog",
  "Link": "https://hiddedesmet.com/bicep-vs-terraform-the-iac-showdown",
  "Description": "The Infrastructure as Code (IaC) landscape has evolved dramatically over the past few years, with organizations increasingly adopting declarative approaches to manage their cloud resources. Two prominent players have emerged as frontrunners in this space: **Azure Bicep** and **HashiCorp Terraform**. Recently, **OpenTofu** has joined as a community-driven fork of Terraform, offering the same capabilities under open-source governance. While all these tools aim to solve the same fundamental problem (provisioning and managing infrastructure through code), they take different approaches to governance and platform focus.\n\nAfter working extensively with both Bicep and Terraform across various projects and cloud environments, I‚Äôve developed strong opinions about when to use each. This isn‚Äôt just another feature comparison; it‚Äôs a practical guide based on real-world experience, complete with examples, best practices, and honest assessments of each tool‚Äôs strengths and weaknesses, plus insights on when OpenTofu might be the right choice.\n\n## Quick comparison overview\n\n| Aspect | Bicep | Terraform | OpenTofu | | --- | --- | --- | --- | | **Cloud Support** | Azure only | Multi-cloud | Multi-cloud (same as Terraform) | | **Learning Curve** | Gentle (for Azure devs) | Moderate | Identical to Terraform | | **State Management** | Azure-managed | Manual/Remote | Manual/Remote (same as Terraform) | | **Syntax** | Clean, intuitive | Verbose but consistent | Identical to Terraform | | **Features** | Azure-focused | Full multi-cloud | Same feature set as Terraform | | **Community** | Growing | Large | Emerging (Terraform-compatible) | | **Vendor** | Microsoft | IBM (HashiCorp) | Linux Foundation | | **License** | MIT | MPL 2.0 | MPL 2.0 | | **Best For** | Azure-first teams | Multi-cloud environments | Open-source advocates who want Terraform |\n\n## Understanding the fundamental differences\n\nBefore diving into technical details, it‚Äôs important to understand the core philosophical differences between these tools:\n\n**Bicep** represents Microsoft‚Äôs vision of Azure-native infrastructure management. It‚Äôs designed specifically for Azure, embracing the platform‚Äôs unique characteristics and providing deep integration with Azure Resource Manager (ARM). Think of it as the ‚Äúnative son‚Äù approach: built by Azure, for Azure.\n\n**Terraform** embodies HashiCorp‚Äôs multi-cloud philosophy. It‚Äôs designed to be cloud-agnostic, treating all cloud providers as equals through its provider ecosystem. This is the ‚Äúuniversal translator‚Äù approach: one language to rule them all.\n\n**OpenTofu** is essentially Terraform with different governance. Since it‚Äôs a fork of Terraform, it shares identical syntax, features, and capabilities. The key difference is organizational: OpenTofu is managed by the Linux Foundation as a truly open-source project, while Terraform is now owned by IBM. From a technical standpoint, they‚Äôre virtually identical.\n\n## Syntax and developer experience: First impressions matter\n\n### Bicep: Clarity through simplicity\n\nBicep‚Äôs syntax feels refreshingly clean, especially if you‚Äôre coming from ARM templates. Here‚Äôs a simple storage account example:\n\n```bicep param location string = resourceGroup().location param storageAccountName string = 'mystorageacct${uniqueString(resourceGroup().id)}'\n\nresource storageAccount 'Microsoft.Storage/storageAccounts@2024-01-01' = { name: storageAccountName location: location sku: { name: 'Standard_LRS' } kind: 'StorageV2' properties: { accessTier: 'Hot' } }\n\noutput storageAccountKey string = storageAccount.listKeys().keys[0].value\n\n```\n\nThe beauty of Bicep syntax lies in its intuitive feel for Azure developers. Resource definitions read almost like natural language, while strong typing provides excellent IntelliSense support that makes development feel effortless. The automatic dependency management through symbolic references eliminates much of the complexity that comes with orchestrating infrastructure deployments.\n\n### Terraform: Consistency across clouds\n\nTerraform‚Äôs HCL (HashiCorp Configuration Language) syntax is more verbose but consistent across all providers:\n\n``` variable \"location\" { description = \"Azure region for resources\" type = string default = \"West Europe\" }\n\nvariable \"resource_group_name\" { description = \"Name of the resource group\" type = string }\n\nresource \"azurerm_storage_account\" \"example\" { name = \"mystorageacct${random_string.suffix.result}\" resource_group_name = var.resource_group_name location = var.location account_tier = \"Standard\" account_replication_type = \"LRS\" account_kind = \"StorageV2\"\n\naccess_tier = \"Hot\" }\n\nresource \"random_string\" \"suffix\" { length = 8 special = false upper = false }\n\noutput \"storage_account_key\" { value = azurerm_storage_account.example.primary_access_key sensitive = true }\n\n```\n\nTerraform‚Äôs strength lies in its consistency across providers and the rich ecosystem that has evolved around it. The same patterns and concepts apply whether you‚Äôre provisioning AWS EC2 instances, Azure storage accounts, or Kubernetes clusters. This consistency becomes invaluable when working across multiple platforms, though it comes at the cost of some Azure-specific optimizations.\n\n## Cloud coverage: Scope vs. depth\n\n### Bicep: Azure excellence\n\nBicep shines when you‚Äôre all-in on Azure. It supports:\n\n- **Every Azure service** from day one of public preview\n- **Latest API versions** immediately available\n- **Azure-specific features** like managed identities, KeyVault integration\n- **Native ARM template compatibility**\n\nThis tight integration means you‚Äôll never wait for a provider update to use the latest Azure features. When Azure releases a new service, Bicep can use it immediately.\n\n### Terraform: Multi-cloud mastery\n\nTerraform‚Äôs strength lies in its breadth:\n\n- **3,000+ providers** covering virtually every cloud and service\n- **Consistent workflows** across AWS, Azure, GCP, and others\n- **Hybrid deployments** managing on-premises and cloud resources together\n- **Third-party services** like DataDog, GitHub, Kubernetes resources\n\nIf you‚Äôre working in a multi-cloud environment or need to manage resources beyond pure cloud infrastructure, Terraform‚Äôs ecosystem is unmatched.\n\n## State management: Different approaches, different trade-offs\n\n### Bicep: Azure-managed state\n\nOne of Bicep‚Äôs most compelling features is **no local state files**. Azure Resource Manager handles all state management:\n\n| ‚úÖ**Advantages** | ‚ùå**Limitations** | | --- | --- | | No state file corruption or conflicts | Tied to Azure‚Äôs deployment model | | Natural team collaboration without state locking | Less flexibility for complex deployment scenarios | | Automatic cleanup of orphaned resources | Harder to manage resources across multiple Azure tenants | | Built-in what-if operations for change preview | Limited to Azure Resource Manager capabilities |\n\n### Terraform: Explicit state control\n\nTerraform‚Äôs state file approach provides fine-grained control:\n\n| ‚úÖ**Advantages** | ‚ö†Ô∏è**Challenges** | | --- | --- | | Complete visibility into managed resources | State file management complexity | | Support for import operations | Potential for state corruption | | Flexible backend options (S3, Azure Storage, Terraform Cloud) | Team collaboration requires careful state locking | | Powerful state manipulation commands | Manual cleanup of orphaned resources |\n\n## Real-world performance and reliability\n\n### Deployment speed\n\n> >\n> üí° **Key insight**: Bicep deployments are generally faster for Azure resources, particularly for complex scenarios involving multiple interdependent resources.\n> >\n\n**Why Bicep is faster:**\n\n- Direct ARM template compilation\n- Azure‚Äôs native orchestration\n- Optimized dependency resolution\n\nTerraform deployments can be slower, especially when managing large numbers of resources, but the gap has narrowed significantly with recent performance improvements.\n\n### Error handling and debugging\n\n> >\n> üîç **Pro tip**: Bicep provides superior error messages for Azure-specific issues. When something goes wrong, you get clear, actionable error messages that directly relate to Azure concepts.\n> >\n\nTerraform‚Äôs error messages can be more cryptic, particularly when dealing with provider-specific issues. However, Terraform‚Äôs plan output is generally more detailed for understanding what changes will be applied.\n\n## Best practices I‚Äôve learned\n\n### Choosing Bicep for Azure-native excellence\n\nBicep shines brightest when you‚Äôre building solutions that live and breathe Azure. If your organization has made the strategic decision to standardize on Microsoft‚Äôs cloud platform, Bicep offers a development experience that feels natural and intuitive. Teams already familiar with ARM templates will find the transition almost effortless, while newcomers appreciate how directly Bicep concepts map to Azure resources.\n\nThe immediate access to new Azure features is another compelling reason to choose Bicep. When Microsoft releases new services or capabilities, they‚Äôre available in Bicep on day one‚Äîno waiting for third-party providers to catch up. This can be crucial for organizations that want to leverage cutting-edge Azure capabilities as soon as they‚Äôre available.\n\n**Key scenarios where Bicep excels:**\n\n- Azure-first organizations looking to standardize on Microsoft tooling\n- Teams migrating from ARM templates seeking better syntax and tooling\n- Projects requiring immediate access to new Azure features\n- Development teams that prefer integrated Microsoft development experiences\n- Organizations wanting to minimize external dependencies and state management complexity\n\n```bicep // Example of a well-structured Bicep module param environmentName string param location string = resourceGroup().location\n\nvar tags = { Environment: environmentName ManagedBy: 'Bicep' CreatedDate: utcNow('yyyy-MM-dd') }\n\nmodule networking 'modules/networking.bicep' = { name: 'networking-deployment' params: { environmentName: environmentName location: location tags: tags } }\n\nmodule compute 'modules/compute.bicep' = { name: 'compute-deployment' params: { environmentName: environmentName location: location subnetId: networking.outputs.subnetId tags: tags } }\n\n```\n\n```bicep // Example of a well-structured Bicep module following best practices param environmentName string param location string = resourceGroup().location\n\nvar tags = { Environment: environmentName ManagedBy: 'Bicep' CreatedDate: utcNow('yyyy-MM-dd') }\n\nmodule networking 'modules/networking.bicep' = { name: 'networking-deployment' params: { environmentName: environmentName location: location tags: tags } }\n\nmodule compute 'modules/compute.bicep' = { name: 'compute-deployment' params: { environmentName: environmentName location: location subnetId: networking.outputs.subnetId tags: tags } }\n\n```\n\n### Choosing Terraform for multi-cloud flexibility\n\nTerraform becomes the clear winner when your infrastructure story extends beyond a single cloud provider. Whether you‚Äôre orchestrating resources across AWS, Azure, and Google Cloud, or integrating cloud services with on-premises infrastructure, Terraform‚Äôs provider ecosystem is unmatched. The consistent syntax and approach across all providers means your team can apply the same concepts and patterns regardless of the underlying platform.\n\nThe mature ecosystem surrounding Terraform is another significant advantage. With thousands of community-contributed modules, chances are someone has already solved the infrastructure challenge you‚Äôre facing. This can dramatically accelerate development time, though it‚Äôs important to thoroughly validate any modules you incorporate into your infrastructure.\n\nTerraform also offers more sophisticated state management capabilities, which becomes crucial as your infrastructure grows in complexity. The ability to manipulate state, import existing resources, and use advanced features like workspaces provides the flexibility needed for enterprise-scale deployments.\n\n**Terraform excels in these scenarios:**\n\n- Multi-cloud or hybrid cloud architectures requiring consistent tooling\n- Organizations with diverse infrastructure requirements spanning multiple providers\n- Teams that value large community ecosystems and extensive module libraries\n- Complex deployments requiring advanced state management and manipulation\n- Projects needing to integrate cloud resources with existing on-premises infrastructure\n\n```\n# Example of a well-structured Terraform configuration\nterraform { required_version = \">= 1.12.2\" required_providers { azurerm = { source = \"hashicorp/azurerm\" version = \"~> 4.34.0\" } }\n\nbackend \"azurerm\" { resource_group_name = \"terraform-state-rg\" storage_account_name = \"terraformstatestorage\" container_name = \"tfstate\" key = \"prod.terraform.tfstate\" } }\n\nvariable \"environment\" { description = \"The deployment environment\" type = string validation { condition = contains([\"dev\", \"staging\", \"prod\"], var.environment) error_message = \"Environment must be dev, staging, or prod.\" } }\n\nlocals { common_tags = { Environment = var.environment ManagedBy = \"Terraform\" Project = \"MyProject\" } }\n\nmodule \"networking\" { source = \"./modules/networking\"\n\nenvironment = var.environment tags = local.common_tags }\n\nmodule \"compute\" { source = \"./modules/compute\"\n\nenvironment = var.environment subnet_id = module.networking.subnet_id tags = local.common_tags }\n\n```\n\n## Learning curve considerations\n\n### Bicep: Easier for Azure developers\n\nIf you‚Äôre already working with Azure, **Bicep has a remarkably gentle learning curve**. The syntax is intuitive, the tooling is excellent, and the concepts map directly to Azure resources you already understand.\n\n**Time to productivity:** 1-2 weeks for basic competency, 1-2 months for advanced scenarios.\n\n### Terraform: More complex but worthwhile\n\nTerraform requires more upfront investment to understand concepts like providers, state, workspaces, and the HCL language itself. However, this investment pays dividends if you‚Äôre working across multiple platforms.\n\n**Time to productivity:** 2-4 weeks for basic competency, 2-3 months for advanced multi-cloud scenarios.\n\n## Cost considerations beyond licensing\n\nWhile both Bicep and Terraform are free to use, the total cost of ownership tells a more nuanced story. These costs extend far beyond software licensing to include learning curves, operational overhead, and long-term maintenance.\n\n**Bicep‚Äôs cost advantages stem from simplicity and integration.** Azure-focused teams can become productive faster, reducing the time and cost associated with training and onboarding. The elimination of state file management removes an entire category of operational complexity, reducing both infrastructure costs and the human effort required to maintain reliable deployments. For organizations already invested in Microsoft tooling, Bicep integrates seamlessly with existing development workflows, minimizing additional tool licensing and training costs.\n\n**Terraform‚Äôs costs are front-loaded but offer long-term flexibility benefits.** The initial learning investment is higher, especially for teams new to infrastructure as code concepts. State management requires additional infrastructure and operational processes, adding complexity and cost. However, these investments pay dividends in multi-cloud scenarios where Terraform‚Äôs consistency can actually reduce overall complexity compared to learning multiple cloud-specific tools.\n\nOrganizations should also consider the cost of potential vendor lock-in. While Bicep ties you to Azure, this might align perfectly with your business strategy. Terraform provides more flexibility but requires ongoing investment in maintaining multi-provider expertise.\n\n## Team and organizational factors\n\n### Why team dynamics matter more than technical features\n\nThe choice between Bicep and Terraform often comes down to organizational context rather than pure technical merit. I‚Äôve seen technically superior solutions fail because they didn‚Äôt align with team capabilities, organizational culture, or long-term strategy.\n\n**Bicep succeeds when organizations embrace Azure-first thinking.** If your company has made the strategic decision to standardize on Microsoft technologies, choosing Bicep reinforces that decision and provides a more integrated development experience. Teams that already understand Azure concepts will be productive with Bicep much faster than learning Terraform‚Äôs abstractions.\n\n**Terraform thrives in organizations that value flexibility and want to avoid vendor lock-in.** Companies that operate in regulated industries, work with multiple cloud providers, or have complex hybrid environments often find Terraform‚Äôs provider ecosystem invaluable. The learning investment pays dividends when you need to manage resources across different platforms with consistent tooling.\n\nThe size and structure of your team also influences the decision. Smaller, Azure-focused teams often prefer Bicep‚Äôs simplicity and integration with Microsoft tooling. Larger organizations with dedicated infrastructure teams and diverse platform requirements typically benefit from Terraform‚Äôs flexibility and ecosystem.\n\n### Skill development and career considerations\n\nFrom a career development perspective, both tools offer valuable skills, but with different market dynamics. Terraform skills are more transferable across organizations and cloud providers, making it attractive for consultants and engineers who change roles frequently. Bicep expertise, while more specialized, is highly valued in Microsoft-centric organizations and can complement broader Azure architecture skills.\n\nConsider your team‚Äôs current expertise and career goals. If your developers are already deep in the Microsoft ecosystem, Bicep represents a natural progression. If your team works across multiple platforms or wants to maintain cloud-agnostic skills, Terraform provides broader market applicability.\n\n## Advanced use cases\n\n### Large-scale deployments\n\nFor large-scale Azure deployments, both tools handle complexity well, but differently:\n\n**Bicep excels at:**\n\n- Azure-specific resource relationships\n- Native ARM template integration\n- Immediate access to new Azure features\n\n**Terraform excels at:**\n\n- Cross-provider resource management\n- Complex data transformations\n- Advanced provisioning logic\n\n### GitOps and CI/CD integration\n\nBoth tools integrate well with modern DevOps practices:\n\n**Bicep CI/CD strengths:**\n\n- Native GitHub Actions integration\n- Azure DevOps built-in tasks\n- Simple artifact management (no state files)\n\n**Terraform CI/CD strengths:**\n\n- Mature ecosystem of CI/CD integrations\n- Terraform Cloud native workflows\n- Advanced plan and apply automation\n\n## My recommendation framework\n\nAfter years of working with both tools, here‚Äôs my decision framework:\n\n### Choose Bicep if:\n\n1. **You‚Äôre Azure-first**: 80%+ of your infrastructure is on Azure\n2. **You want simplicity**: Prefer fewer moving parts and concepts\n3. **You‚Äôre migrating from ARM**: Natural evolution path\n4. **You value immediate feature access**: Need latest Azure features ASAP\n\n### Choose Terraform if:\n\n1. **You‚Äôre multi-cloud**: Managing resources across multiple providers\n2. **You‚Äôre hybrid**: Mix of cloud and on-premises resources\n3. **You value ecosystem**: Want access to community modules and providers\n4. **You need flexibility**: Require advanced state management and automation\n\n### Choose OpenTofu if:\n\n1. **Open-source priority**: Community governance is important to you\n2. **Vendor independence**: Want to avoid corporate control\n3. **Terraform compatibility**: Need existing Terraform code to work\n4. **Long-term stability**: Prefer predictable licensing\n\n## Decision flowchart\n\n```mermaid flowchart TD A[Starting IaC Journey] --> B{Azure Only?} B -->|Yes| C{Team familiar with ARM?} B -->|No| D{Open Source Priority?}\n\nC -->|Yes| E[Choose Bicep] C -->|No| F{Want simplicity?} F -->|Yes| E F -->|No| G[Consider Terraform]\n\nD -->|Yes| H[Choose OpenTofu] D -->|No| I{IBM concerns?} I -->|Yes| H I -->|No| J[Choose Terraform]\n\nstyle E fill:#0078d4,color:#fff style H fill:#ff6b35,color:#fff style J fill:#623ce4,color:#fff\n\n```\n\n### A practical hybrid approach\n\nIn larger organizations, I‚Äôve seen successful implementations using **both tools**:\n\n- **Terraform for foundational infrastructure**: Networking, security, shared services\n- **Bicep for application-specific resources**: App Services, Functions, databases\n\nThis approach leverages each tool‚Äôs strengths while minimizing their weaknesses.\n\n## Future developments\n\nBoth tools are rapidly evolving:\n\n### What‚Äôs next for Bicep\n\n- Enhanced module ecosystem\n- Better multi-subscription deployment support\n- Improved testing and validation tools\n- Potential expansion beyond Azure (though unlikely)\n\n### What‚Äôs next for Terraform\n\n- Continued performance improvements\n- Enhanced cloud provider integrations\n- Better developer experience tools\n- Terraform Cloud feature expansion\n\n## The IBM acquisition factor\n\nIt‚Äôs impossible to discuss Terraform‚Äôs future without addressing the elephant in the room: IBM‚Äôs acquisition of HashiCorp in 2024. This major change brings both opportunities and concerns that organizations need to consider when making long-term IaC decisions.\n\n### Potential benefits\n\n- **Enterprise integration**: IBM‚Äôs enterprise focus could lead to better integration with existing enterprise tools and workflows\n- **Increased investment**: More resources for development and support\n- **Hybrid cloud expertise**: IBM‚Äôs hybrid cloud experience could enhance Terraform‚Äôs multi-cloud capabilities\n\n### Potential concerns\n\n- **Licensing changes**: History shows that acquisitions often lead to licensing model changes that could affect cost\n- **Product direction shifts**: IBM‚Äôs strategic priorities might influence Terraform‚Äôs roadmap in unexpected ways\n- **Community impact**: The open-source community‚Äôs relationship with the project could change under corporate ownership\n- **Vendor lock-in risks**: What was once a vendor-neutral tool is now owned by a cloud provider competitor\n\n### What this means for your decision\n\nIf you‚Äôre choosing between Bicep and Terraform today, the IBM acquisition adds a new variable to consider:\n\n- **For risk-averse organizations**: The uncertainty around Terraform‚Äôs future under IBM might make Bicep‚Äôs Microsoft backing more appealing for Azure-focused teams\n- **For multi-cloud strategies**: You‚Äôll want to monitor how IBM‚Äôs ownership affects Terraform‚Äôs neutrality across cloud providers\n- **For existing Terraform users**: Consider diversification strategies or at minimum, stay informed about licensing and product direction changes\n\nThe acquisition is still relatively recent, and its full implications won‚Äôt be clear for some time. However, it‚Äôs a reminder that no tool exists in a vacuum, and vendor relationships matter when making infrastructure decisions.\n\n### The OpenTofu alternative\n\nSpeaking of vendor concerns, it‚Äôs worth mentioning **OpenTofu**, the open-source fork of Terraform that emerged in response to HashiCorp‚Äôs licensing changes. Maintained by the Linux Foundation, OpenTofu is essentially Terraform with different governance - it shares the same syntax, features, and capabilities.\n\n**Why consider OpenTofu:**\n\n- **Identical to Terraform**: Same syntax, same providers, same state files - it‚Äôs a drop-in replacement\n- **True open source**: No vendor lock-in or licensing restrictions\n- **Community governance**: Managed by the Linux Foundation rather than a single company\n- **100% Terraform compatibility**: Existing Terraform configurations work without changes\n- **Active development**: Growing community and regular releases\n\n**Current considerations:**\n\n- **Smaller ecosystem**: Fewer third-party tools and resources compared to Terraform\n- **Provider timing**: Some providers may release updates for Terraform first, then OpenTofu\n- **Enterprise tooling**: Terraform Cloud ecosystem is more mature than OpenTofu alternatives\n\nFor organizations concerned about vendor control or licensing costs, OpenTofu adds a third path to consider alongside Bicep and Terraform. It‚Äôs particularly appealing if you value open-source principles and want to avoid potential future licensing surprises.\n\n## What about other IaC tools?\n\nWhile this post focuses on the declarative configuration language approach (Bicep, Terraform, OpenTofu), it‚Äôs worth acknowledging that other IaC paradigms exist:\n\n**Pulumi** takes a different approach entirely, using general-purpose programming languages (TypeScript, Python, Go, C#) instead of domain-specific languages. This appeals to developers who prefer familiar programming constructs like loops, conditionals, and functions over declarative configurations.\n\n**AWS CDK, Azure CDK for Terraform, and similar tools** also use programming languages but compile to other IaC formats (CloudFormation, Terraform) rather than running directly.\n\nThese imperative approaches have their own trade-offs around testability, debugging, and team collaboration that deserve a dedicated comparison. For this post, I‚Äôve focused on the declarative DSL ecosystem since that‚Äôs where most organizations start their IaC journey.\n\n## Final thoughts\n\nChoosing between Bicep, Terraform, and OpenTofu isn‚Äôt just a technical decision. It‚Äôs a strategic one that affects your team‚Äôs productivity, your organization‚Äôs flexibility, and your long-term infrastructure management approach.\n\n**Bicep represents focused specialization**: deep, native integration with Azure that provides excellent developer experience and immediate access to Azure innovations. If you‚Äôre building on Azure and plan to stay there, Bicep‚Äôs focused approach pays dividends in team productivity and reduced complexity.\n\n**Terraform embodies flexible standardization**: one tool, one workflow, across all your infrastructure needs. If you‚Äôre in a multi-cloud world or value the flexibility to change direction, Terraform‚Äôs ecosystem and proven track record make it a reliable choice, though the IBM acquisition adds uncertainty.\n\n**OpenTofu offers open-source assurance**: for teams that prioritize community governance and want to avoid vendor dependencies, it provides Terraform compatibility without the corporate overhead.\n\nThe reality is that all these tools are excellent at what they do. The choice comes down to understanding your organization‚Äôs needs, constraints, risk tolerance, and long-term strategy. There‚Äôs no wrong choice here, only choices that are more or less aligned with your specific context.\n\nWhat matters most is picking one, learning it well, and building great infrastructure with it. The best IaC tool is the one your team actually uses effectively, not the one with the most features on paper.\n\n## üìã Key takeaways\n\n| Tool | Best for | Key advantage | Main concern | | --- | --- | --- | --- | | **üîµ Bicep** | Azure-focused teams | Native integration, no state files | Limited to Azure only | | **üü£ Terraform** | Multi-cloud environments | Mature ecosystem, broad provider support | IBM acquisition uncertainty | | **üü† OpenTofu** | Open-source advocates | Community governance, vendor independence | Smaller ecosystem |\n\n> >\n> üéØ **Bottom line**: Choose Bicep for Azure simplicity, Terraform for multi-cloud maturity, or OpenTofu for open-source peace of mind. All are solid choices when used appropriately.\n> >\n\n*What‚Äôs been your experience with Bicep and Terraform? I‚Äôd love to hear about your real-world usage patterns and any challenges you‚Äôve encountered. Share your thoughts in the comments below or reach out to me directly.*",
  "Title": "Bicep vs Terraform vs OpenTofu: Your Infrastructure as Code options in 2025",
  "PubDate": "2025-06-22T09:00:00+00:00"
}
