{
  "Tags": [
    "ASP.NET Core",
    "C#",
    "MassTransit",
    "messaging",
    "Microservices",
    "NServiceBus",
    "rebus"
  ],
  "OutputDir": "_posts",
  "FeedLevelAuthor": "Code Maze",
  "ProcessedDate": "2025-08-05 14:18:57",
  "FeedUrl": "https://code-maze.com/feed/",
  "Title": "Comparison of Rebus, NServiceBus, and MassTransit in .NET",
  "Description": "Messaging systems are the backbone of scalable and distributed applications in .NET. They allow different parts of an application, or even separate applications, to communicate efficiently and reliably. Choosing the right messaging library, Rebus, NServiceBus, or MassTransit, is essential to ensure our system’s performance and long-term maintainability. In this article, we will compare Rebus, NServiceBus, […]\n\nThe post [Comparison of Rebus, NServiceBus, and MassTransit in .NET](https://code-maze.com/aspnetcore-comparison-of-rebus-nservicebus-and-masstransit/) appeared first on [Code Maze](https://code-maze.com).",
  "Link": "https://code-maze.com/aspnetcore-comparison-of-rebus-nservicebus-and-masstransit/",
  "FeedName": "Code Maze Blog",
  "Author": "Michal Kaminski",
  "EnhancedContent": "# Comparison of Rebus, NServiceBus, and MassTransit in .NET\n\nPosted by [Michal Kaminski](https://code-maze.com/author/michal-kaminski/) | Dec 16, 2024 | [0](https://code-maze.com/aspnetcore-comparison-of-rebus-nservicebus-and-masstransit/#comments)\n\n![Comparison of Rebus, NServiceBus, and MassTransit in .NET](https://code-maze.com/wp-content/uploads/2021/12/social-aspnetcore.png)\n\n[!\\[Code Maze Book Collection\\](https://code-maze.com/wp-content/uploads/2024/10/courses-template-wide.png)](https://courses.code-maze.com/courses/?source=tbanner&p=aspnetcore-comparison-of-rebus-nservicebus-and-masstransit/)\n\nReady to take your skills to the next level? Jump into our high-impact courses in web development and software architecture, all with a focus on mastering the .NET/C# framework. Whether you're **building sleek web applications or designing scalable software solutions**, our expert-led training will give you the tools to succeed. Visit our **[COURSES](https://courses.code-maze.com/courses/?source=tbanner&p=aspnetcore-comparison-of-rebus-nservicebus-and-masstransit/)** page now and kickstart your journey!\n\nMessaging systems are the backbone of scalable and distributed applications in .NET. They allow different parts of an application, or even separate applications, to communicate efficiently and reliably. Choosing the right messaging library, Rebus, NServiceBus, or MassTransit, is essential to ensure our system’s performance and long-term maintainability.\n\nIn this article, we will compare Rebus, NServiceBus, and MassTransit—three of the most popular .NET service bus libraries.\n\nTo download the source code for this article, you can visit our [GitHub repository](https://github.com/CodeMazeBlog/CodeMazeGuides/tree/main/dotnet-client-libraries/MessagingComparisons).\n\nLet’s dive in.\n\nSupport Code Maze on Patreon to get rid of ads and get the best discounts on our products!\n\n[![Become a patron at Patreon!](https://code-maze.com/wp-content/plugins/patron-plugin-pro/plugin/lib/patron-button-and-widgets-by-codebard/images/become_a_patron_button.png)](https://www.patreon.com/oauth2/become-patron?response_type=code&amp;min_cents=100&amp;client_id=9_akhcsDQMGo-FTlVmNpM_uxSV4fbW3vnrz7CBRV9RxwjMPCLfWgodhrcE0UuHH4&amp;scope=identity%20identity[email]&amp;redirect_uri=https://code-maze.com/patreon-authorization/&amp;state=eyJmaW5hbF9yZWRpcmVjdF91cmkiOiJodHRwczpcL1wvY29kZS1tYXplLmNvbVwvaGF0ZW9hcy1hc3BuZXQtY29yZS13ZWItYXBpXC8ifQ%3D%3D&amp;utm_source=https%3A%2F%2Fcode-maze.com%2Fhateoas-aspnet-core-web-api%2F&amp;utm_medium=patreon_wordpress_plugin&amp;utm_campaign=11086160&amp;utm_term=&amp;utm_content=post_unlock_button)\n\n## Introducing the Contenders\n\nFor messaging in .NET, Rebus, NServiceBus, and MassTransit are the top choices, so let’s examine what each offers.\n\nFirst, let’s define a simple message:\n\n``` public class Message { public string MessageId { get; set; } = string.Empty; public string Content { get; set; } = string.Empty; } ```\n\nFurther in the article, we will be handling messages of this type.\n\n### Rebus\n\n[Rebus](https://github.com/rebus-org/Rebus) is an open-source, lightweight service bus focused on simplicity and ease of use. It requires minimal setup, allowing developers to implement messaging systems quickly.\n\n**Rebus’s biggest advantage is its flexibility and extendability, which allows us to adapt it to our project’s specific requirements.**\n\nNow, let’s configure Rebus:\n\n``` builder.Services.AddRebus(configure => configure .Transport(t => t.UseInMemoryTransport(new InMemNetwork(true), \"MyQueue\")) .Routing(r => r.TypeBased().MapAssemblyOf<Message>(\"MyQueue\"))); builder.Services.AutoRegisterHandlersFromAssemblyOf<Program>(); ```\n\nHere, we set up Rebus to use an in-memory transport layer and route all messages of `Message` type to the designated queue.\n\nLastly, the `AutoRegisterHandlersFromAssemblyOf<Program>()` method registers all handlers from our assembly.\n\nIn brief, Rebus is ideal for small to medium applications where simplicity and ease of use are priorities.\n\n### NServiceBus\n\nNext is [NServiceBus](https://github.com/Particular/NServiceBus), a feature-rich service bus designed for enterprise-level applications. It offers advanced capabilities that make it suitable for large-scale enterprise systems.\n\nIs this material useful to you? Consider subscribing and get **ASP.NET Core Web API Best Practices** eBook for [FREE!](https://code-maze.com/free-ebook-aspnetcore-webapi-best-practices/)\n\n**What sets NServiceBus apart is its suite of monitoring and debugging tools, such as ServicePulse and ServiceInsight.** These tools provide real-time visibility into our messaging system, making it easier to maintain and troubleshoot.\n\nHowever, setting up NServiceBus requires more configuration than Rebus, but this comes with greater control and a rich set of features:\n\n``` builder.Host.UseNServiceBus(context => { var endpointConfiguration = new EndpointConfiguration(\"HandlerEndpoint\");\n\nvar transport = endpointConfiguration.UseTransport<LearningTransport>(); var serialization = endpointConfiguration.UseSerialization<SystemJsonSerializer>();\n\nvar routing = transport.Routing(); routing.RouteToEndpoint(typeof(Message), \"HandlerEndpoint\");\n\nreturn endpointConfiguration; }); ```\n\nIn this example, we configure NServiceBus to use `LearningTransport` as a transport layer and route instances of `ProcessPayment` class to the designated endpoint.\n\nOwing to great commercial support from Particular Software, NServiceBus is a great choice for high-scale enterprise applications.\n\n### MassTransit\n\nLastly, [MassTransit](https://github.com/MassTransit/MassTransit) is another open-source service bus focusing on ease of use and flexibility.\n\n**MassTransit strikes a balance between the simplicity of Rebus and the advanced features of NServiceBus, making it a versatile option for a wide range of applications.**\n\nOne of the strengths of MassTransit is its fluent configuration APIs, which simplify the setup process. Moreover, it also supports advanced messaging patterns, including sagas and state machines:\n\n``` builder.Services.AddMassTransit(x => { x.AddConsumer<MessageHandler>(); x.UsingInMemory((context, cfg) => { cfg.ConfigureEndpoints(context); }); }); ```\n\nSimilarly, we set up MassTransit to use an in-memory transport layer and configure the `MessageHandler` as a message consumer.\n\nIs this material useful to you? Consider subscribing and get **ASP.NET Core Web API Best Practices** eBook for [FREE!](https://code-maze.com/free-ebook-aspnetcore-webapi-best-practices/)\n\nMassTransit balances performance and complexity, making it useful in medium to large applications.\n\n### Supported Transports and Protocols\n\nNext, let’s explore their differences in supported transports.\n\nThe choice of transport can significantly impact our messaging system, depending on our existing infrastructure and performance requirements.\n\nLet’s have a look at a quick comparison of supported transports:\n\n| Transport | Rebus | NServiceBus | MassTransit | | --- | --- | --- | --- | | ActiveMQ | No | No | Yes | | Amazon SQS | Yes | Yes | Yes | | Azure Service Bus | Yes | Yes | Yes | | MSMQ | Yes | Yes | No | | RabbitMQ | Yes | Yes | Yes | | SQL Server | Yes | Yes | Yes |\n\nAs we can see, in addition to the common options, NServiceBus and Rebus also support MSMQ, which can benefit legacy systems or environments requiring specific messaging protocols.\n\n## Saga Implementation\n\nManaging complex, long-running processes often requires coordinating multiple messages and maintaining state across different steps.\n\nThis is where sagas come into play. Sagas are a pattern that helps manage such workflows, ensuring data consistency and orchestrating the sequence of operations.\n\nFirstly, we have a choreography-based saga, where we have a message bus that transfers messages between producers and consumers:\n\nIs this material useful to you? Consider subscribing and get **ASP.NET Core Web API Best Practices** eBook for [FREE!](https://code-maze.com/free-ebook-aspnetcore-webapi-best-practices/)\n\n[![choreography-based saga with message bus](https://code-maze.com/wp-content/uploads/2024/12/Sagas-Choreography-Based-Saga.drawio-1.png)](https://code-maze.com/wp-content/uploads/2024/12/Sagas-Choreography-Based-Saga.drawio-1.png)\n\nAlternatively, we can replace the message bus with a specialized service that orchestrates the saga and thus end up with an orchestration-based saga:\n\n[![choreography-based saga with specialized service instead of message bus](https://code-maze.com/wp-content/uploads/2024/12/orchestration-based-saga.drawio.png)](https://code-maze.com/wp-content/uploads/2024/12/orchestration-based-saga.drawio.png)\n\n**It is worth noting that all three libraries support both saga pattern implementations.**\n\nIf you want to read more about implementing the saga pattern, read our articles about [NServiceBus](https://code-maze.com/csharp-saga-pattern-with-nservicebus/) and [Rebus](https://code-maze.com/dotnet-implementing-the-saga-pattern-using-rebus-and-rabbitmq/) implementations.\n\n## Error Handling and Retries\n\nError handling is critical in any messaging system, ensuring every message is processed even when unexpected issues occur. Each library offers different mechanisms for handling errors and implementing retry policies.\n\n### Error Handling and Retries In Rebus\n\nRebus provides a straightforward approach to error handling and message retries. **By default, Rebus will attempt to process a message multiple times before moving it to an error queue.** This behavior ensures that transient issues, such as temporary network glitches or resource contention, do not result in lost messages.\n\nLet’s customize the retry behavior in Rebus using the `RetryStrategy()` method:\n\n``` configure.Options(o => o.RetryStrategy( maxDeliveryAttempts: 5, secondLevelRetriesEnabled: true, errorQueueName: \"ErrorQueue\" )); ```\n\nIn this example, the `maxDeliveryAttempts` option controls how many times Rebus will retry immediately. The `secondLevelRetriesEnabled` option ensures Rebus will attempt a delayed retry after the first set fails. Finally, the `errorQueueAddress` defines error queue where the message moves if all attempts fail.\n\nTo explain, the first attempts are immediate retries, meaning Rebus will quickly retry processing the message without delay. If all attempts fail, second-level retries introduce a delay before another retry attempt instead of immediately moving the message to the error queue.\n\nThese delays allow temporary conditions, like network instability or external service unavailability, to be resolved.\n\n### Error Handling and Retries In NServiceBus\n\n**NServiceBus also provides built-in retry mechanisms that handle both immediate and delayed retries.**\n\nLet’s configure both immediate and delayed retries using the `Recoverability` settings:\n\n``` var recoverability = endpointConfiguration.Recoverability();\n\nrecoverability.Immediate(immediate => immediate.NumberOfRetries(3) );\n\nrecoverability.Delayed(delayed => { delayed.NumberOfRetries(2); delayed.TimeIncrease(TimeSpan.FromSeconds(5)); });\n\nendpointConfiguration.SendFailedMessagesTo(\"ErrorQueue\"); ```\n\nIn this example, NServiceBus will attempt immediate retries three times and then perform two delayed retries if the message fails to process. If all retry attempts are unsuccessful, NServiceBus will move the message to the error queue.\n\nIs this material useful to you? Consider subscribing and get **ASP.NET Core Web API Best Practices** eBook for [FREE!](https://code-maze.com/free-ebook-aspnetcore-webapi-best-practices/)\n\nAdditionally, **NServiceBus allows us to implement custom retry policies by providing a custom recoverability policy:**\n\n``` recoverability.CustomPolicy((config, context) => { if (context.Exception is TimeoutException) { return RecoverabilityAction.ImmediateRetry(); }\n\nreturn RecoverabilityAction.MoveToError(\"ErrorQueue\"); }); ```\n\nAs we can see, NServiceBus will attempt an immediate retry only in the case of a `TimeoutException` exception. Otherwise, it will redirect the message to an error queue.\n\n### Error Handling and Retries In MassTransit\n\n**Even MassTransit provides flexible error handling and retry capabilities through its built-in middleware.** It allows us to configure retries with various strategies, such as immediate retries, intervals, and exponential back-off.\n\nLet’s define the retry policy with MassTransit:\n\n``` cfg.ReceiveEndpoint(\"MyQueue\", e => e.UseMessageRetry(r => r.Interval(3, TimeSpan.FromSeconds(2)))); ```\n\nIn this example, the `Interval()` specifies that MassTransit should retry the message three times with a 2-second interval between attempts. If all retry attempts fail, MassTransit will move the message to an error queue.\n\n**MassTransit automatically creates error queues by adding `_error` to the end of each endpoint’s name.**\n\n## Monitoring and Instrumentation\n\nMonitoring the health and performance of our applications is crucial for spotting potential issues early on. Each library offers different tools and integrations to help us monitor our systems.\n\nRebus and MassTransit integrate with logging frameworks like [Serilog](https://code-maze.com/structured-logging-in-asp-net-core-with-serilog/), allowing us to capture logs.\n\nIs this material useful to you? Consider subscribing and get **ASP.NET Core Web API Best Practices** eBook for [FREE!](https://code-maze.com/free-ebook-aspnetcore-webapi-best-practices/)\n\n**Compared to Rebus and MassTransit, NServiceBus takes monitoring further by providing dedicated tools like ServicePulse and ServiceInsight.**\n\nServicePulse offers real-time monitoring of our endpoints, highlighting failed messages and providing insights into system performance.\n\nServiceInsight allows us to visualize message flows and dive deep into the message processing pipeline, which is invaluable for troubleshooting complex issues.\n\n**Additionally, all libraries support OpenTelemetry, which we can use to collect and send metrics to our preferred analytics tools, such as Grafana or Prometheus.**\n\n## Security Features\n\nSecurity is the most important concern when transmitting messages between services, especially in distributed systems where data may traverse unsecured networks.\n\n### Encryption in Rebus\n\nRebus provides support for securing messages during transport and at rest. It leverages the security features of the underlying transport mechanisms, such as SSL/TLS encryption for protocols like HTTPS, AMQP, or Azure Service Bus.\n\nLet’s see how we can enable automatic message body encryption in Rebus:\n\n`Configure.Options(o => o.EnableEncryption(encryptionKey));`\n\nIs this material useful to you? Consider subscribing and get **ASP.NET Core Web API Best Practices** eBook for [FREE!](https://code-maze.com/free-ebook-aspnetcore-webapi-best-practices/)\n\nThe `EnableEncryption()` method accepts a Base64-encoded encryption key. By default, Rebus uses this key to encrypt message bodies using the AES algorithm.\n\nIf we do not provide a valid key, Rebus will use the built-in .NET functionality to generate the key we can store in the configuration.\n\n**We must remember that encryption applies only to the message body, while the data in the message header will still be unencrypted.**\n\n### Encryption in NServiceBus\n\nSimilarly, NServiceBus also offers out-of-the-box support for message encryption.\n\n**However, in this case, encryption is property-based to reduce its impact on performance. This means we need to specify which properties in the message body we want to encrypt.**\n\nWe can enable the encryption of message properties using the `EnableMessagePropertyEncryption()` method:\n\n``` var encryptionService = new AesEncryptionService( encryptionKeyIdentifier: encryptionKeyId, key: Convert.FromBase64String(encryptionKey));\n\nendpointConfiguration.EnableMessagePropertyEncryption( encryptionService: encryptionService, encryptedPropertyConvention: propertyInfo => propertyInfo.Name.Equals(nameof(Message.Content)) ); ```\n\nIn this example, messages are encrypted using the AES algorithm based on the provided encryption key and identifier.\n\nThe `EnableMessagePropertyEncryption()` method instructs NServiceBus to apply encryption to specific message properties.\n\nIt accepts the `encryptionService` instance and function delegate that defines the convention for selecting which properties should be encrypted. The `propertyInfo` object contains metadata about a message property, such as its name, type, and attributes. In our case, we encrypt the `Content` property of the `Message` instance.\n\n### Encryption in MassTransit\n\nMassTransit also provides options for securing messages through message serialization.\n\nLet’s set it up:\n\n`cfg.UseEncryption(Convert.FromBase64String(encryptionKey));`\n\nAs easy as that, MassTransit provides a `UseEncryption()` method that expects a Base64 encoded encryption key.\n\n## Community and Support\n\nCommunity support and available resources are equally important to the provided features, which can greatly influence the long-term success of our project.\n\nOn one hand, we have Rebus and MassTransit, which are community-driven projects. In both cases, the maintainers are responsive, and plenty of resources, including tutorials and examples, are available online.\n\nThis makes them a great choice for open-source enthusiasts who prefer collaborative support.\n\nIs this material useful to you? Consider subscribing and get **ASP.NET Core Web API Best Practices** eBook for [FREE!](https://code-maze.com/free-ebook-aspnetcore-webapi-best-practices/)\n\nOn the other hand, NServiceBus offers commercial support through Particular Software, providing professional assistance, training, consultancy, and documentation. **This can be a significant advantage for enterprises that require guaranteed support and service-level agreements.**\n\n## Code Comparison\n\nNow that we know some features, let’s explore how to send and receive messages using each library.\n\n### Sending Messages Using Rebus, NServiceBus, and MassTransit\n\nSending a message typically involves creating a message object and dispatching. Let’s see how we can do this with each library.\n\nBut before that, let’s define a common interface:\n\n``` public interface IMessageSender { Task SendMessageAsync(Message message); } ```\n\nThe `IMessageSender` interface defines a `SendMessageAsync()` method that accepts an instance of the `Message` class.\n\nIn Rebus, we send messages by injecting the `IBus` interface into our class and call the `Send()` method.\n\nLet’s define a `RebusMessageSender` class:\n\n``` public class RebusMessageSender(IBus bus) : IMessageSender { public async Task SendMessageAsync(Message message) => await bus.Send(message); } ```\n\nHere, we send an instance of a `Message` class using the `IBus` instance. Rebus routes the message to the appropriate destination based on the configuration.\n\nIs this material useful to you? Consider subscribing and get **ASP.NET Core Web API Best Practices** eBook for [FREE!](https://code-maze.com/free-ebook-aspnetcore-webapi-best-practices/)\n\nWith NServiceBus, we use the `IMessageSession` or `IEndpointInstance` to send messages.\n\nThis time, let’s define a `NServiceBusMessageSender` class for NServiceBus:\n\n``` public class NServiceBusMessageSender(IMessageSession messageSession) : IMessageSender { public async Task SendMessageAsync(Message message) => await messageSession.Send(message); } ```\n\nIn this example, we send a `Message` instance using the `messageSession` instance. NServiceBus handles the routing based on the conventions or explicit mappings defined in the endpoint configuration.\n\nMassTransit allows us to send or publish messages using the `IBus` interface.\n\nFinally, let’s define a `MassTransitMessageSender` class using MassTransit:\n\n``` public class MassTransitMessageSender(IBus bus) : IMessageSender { public async Task SendMessageAsync(Message message) => await bus.Publish(message); } ```\n\nWe use the `Publish()` method to send the message to any subscribers interested in `Message` .\n\nIf we want to send the message to a specific endpoint, we can use the `Send()` method instead:\n\n``` public class MassTransitMessageSender(IBus bus, ISendEndpointProvider sendEndpointProvider) : IMessageSender, ICustomMessageSender { public async Task SendMessageAsync(Message message) => await bus.Publish(message);\n\npublic async Task SendMessageAsync(Message message, string queueUri) { var sendEndpoint = await sendEndpointProvider.GetSendEndpoint(new Uri(queueUri));\n\nawait sendEndpoint.Send(message); } } ```\n\nIn this example, we inject `ISendEndpointProvider` to obtain a reference to a particular endpoint. Then, we use the `GetSendEndpoint()` method with the URI of the destination queue to get the endpoint. Finally, we use the `Send()` method to send the message directly to that endpoint.\n\n### Receiving Messages Using Rebus, NServiceBus, and MassTransit\n\nReceiving messages involves implementing handlers or consumers that process incoming messages. Each library defines these handlers in its own way.\n\nFirst, let’s define a common interface:\n\n``` public interface IMessageHandler { Task Handle(Message message); } ```\n\nThe `IMessageHandler` interface defines a `Handle()` method that accepts an instance of the `Message` class.\n\nNext, let’s define a shared handler class implementing the `IMessageHandler` interface that specific message handlers will invoke:\n\nIs this material useful to you? Consider subscribing and get **ASP.NET Core Web API Best Practices** eBook for [FREE!](https://code-maze.com/free-ebook-aspnetcore-webapi-best-practices/)\n\n``` public class MessageHandler : IMessageHandler { public Task Handle(Message message) { Console.WriteLine($\"MessageId: {message.MessageId}, Content: {message.Content}\");\n\nreturn Task.CompletedTask; } } ```\n\nAs we can see, the `Handle()` method prints to console the details of incoming messages. However, in a real application, this handler would contain business logic.\n\nIn Rebus, we implement the `IHandleMessages<T>` interface for the message type we want to handle. Rebus automatically discovers and registers handlers through dependency injection:\n\n``` public class RebusMessageHandler(IMessageHandler handler) : IHandleMessages<Message> { public Task Handle(Message message) => handler.Handle(message); } ```\n\nIn this example, when a `Message` instance arrives, Rebus invokes the `Handle()` method.\n\nFor NServiceBus, we implement a similar `IHandleMessages<T>` interface:\n\n``` public class NServiceBusMessageHandler(IMessageHandler handler) : IHandleMessages<Message> { public Task Handle(Message message, IMessageHandlerContext context) => handler.Handle(message); } ```\n\nThe `Handle()` method receives the message and an `IMessageHandlerContext` , which provides additional capabilities like sending messages, publishing events, or handling retries.\n\n**It is worth noting that messages handled by NServiceBus handlers must [implement the appropriate interface](https://docs.particular.net/nservicebus/messaging/messages-events-commands#identifying-messages-marker-interfaces) or [follow the convention](https://docs.particular.net/nservicebus/messaging/conventions).**\n\nWe define the message convention in the `Program.cs` file:\n\n``` var conventions = endpointConfiguration.Conventions(); conventions.DefiningMessagesAs(type => type.Namespace == typeof(Message).Namespace); ```\n\nThis way, we define all types in the same namespace as the `Message` class as messages.\n\nIn MassTransit, we define a consumer by implementing the `IConsumer<T>` interface:\n\n``` public class MassTransitMessageHandler(IMessageHandler handler) : IConsumer<Message> { public Task Consume(ConsumeContext<Message> context) { var message = context.Message;\n\nreturn handler.Handle(message); } } ```\n\nMassTransit uses the `Consume()` method, which provides a `ConsumeContext<T>` containing the message and context information. Through this context, we can access headers, publish events, or interact with the message bus.\n\nWhile the basic concepts are similar across the libraries, each has its own conventions and patterns. **Rebus and NServiceBus share a similar interface for handling messages, whereas MassTransit uses the consumer model focusing on the consumption context.**\n\n## Licensing of Rebus, NServiceBus, and MassTransit\n\nFinally, when we select a library, we need to consider the licensing and potential costs involved, as these factors can impact the long-term viability and total cost of ownership for our project.\n\nFirstly, Rebus is released under [the MIT license](https://opensource.org/license/mit), which is a permissive open-source license. **This means we can use it freely in both open-source and proprietary applications without worrying about licensing fees or restrictions.** The MIT license also allows us to modify and distribute the software as we see fit, making Rebus an attractive option for budget-conscious projects.\n\nSecondly, NServiceBus operates under [a proprietary license](https://opensource.org/license/rpl-1-5). **While the core of NServiceBus is available for free, especially for small-scale projects or evaluation purposes, it offers additional features and support through commercial licenses provided by Particular Software.** This commercial aspect includes professional support, training, and advanced tooling like ServicePulse and ServiceInsight.\n\nLastly, MassTransit is licensed under [the Apache License 2.0](https://opensource.org/license/apache-2-0), another permissive open-source license similar to MIT. This allows us to use, modify, and distribute MassTransit freely in our open-source or commercial projects.\n\n## Conclusion\n\nTo summarize, we explored the key features, benefits, and use cases for Rebus, NServiceBus, and MassTransit.\n\nEach library has its strengths and is suited for different scenarios. By understanding their capabilities and considering factors like licensing and cost, we can make informed decisions that align with our application’s requirements and our team’s expertise.\n\n[!\\[Code Maze Book Collection\\](https://code-maze.com/wp-content/uploads/2024/10/courses-template-wide.png)](https://courses.code-maze.com/courses/?source=bbanner&p=aspnetcore-comparison-of-rebus-nservicebus-and-masstransit/)\n\nReady to take your skills to the next level? Jump into our high-impact courses in web development and software architecture, all with a focus on mastering the .NET/C# framework. Whether you're **building sleek web applications or designing scalable software solutions**, our expert-led training will give you the tools to succeed. Visit our **[COURSES](https://courses.code-maze.com/courses/?source=bbanner&p=aspnetcore-comparison-of-rebus-nservicebus-and-masstransit/)** page now and kickstart your journey!\n\nLiked it? Take a second to support Code Maze on Patreon and get the ad free reading experience!\n\n[![Become a patron at Patreon!](https://code-maze.com/wp-content/plugins/patron-plugin-pro/plugin/lib/patron-button-and-widgets-by-codebard/images/become_a_patron_button.png)](https://www.patreon.com/oauth2/become-patron?response_type=code&min_cents=100&client_id=9_akhcsDQMGo-FTlVmNpM_uxSV4fbW3vnrz7CBRV9RxwjMPCLfWgodhrcE0UuHH4&scope=identity%20identity[email]&redirect_uri=https://code-maze.com/patreon-authorization/&state=eyJmaW5hbF9yZWRpcmVjdF91cmkiOiJodHRwczpcL1wvY29kZS1tYXplLmNvbVwvYXNwbmV0Y29yZS1jb21wYXJpc29uLW9mLXJlYnVzLW5zZXJ2aWNlYnVzLWFuZC1tYXNzdHJhbnNpdFwvIn0%3D&utm_source=https%3A%2F%2Fcode-maze.com%2Faspnetcore-comparison-of-rebus-nservicebus-and-masstransit%2F&utm_medium=patreon_wordpress_plugin&utm_campaign=11086160&utm_term=&utm_content=post_unlock_button)\n\nShare:\n\nhttp://www.facebook.com/sharer.php?u=https://code-maze.com/aspnetcore-comparison-of-rebus-nservicebus-and-masstransit/&#038;t=Comparison%20of%20Rebus%2C%20NServiceBus%2C%20and%20MassTransit%20in%20.NEThttp://twitter.com/intent/tweet?text=Comparison%20of%20Rebus%2C%20NServiceBus%2C%20and%20MassTransit%20in%20.NET%20https://code-maze.com/aspnetcore-comparison-of-rebus-nservicebus-and-masstransit/http://www.linkedin.com/shareArticle?mini=true&#038;url=https://code-maze.com/aspnetcore-comparison-of-rebus-nservicebus-and-masstransit/&#038;title=Comparison%20of%20Rebus%2C%20NServiceBus%2C%20and%20MassTransit%20in%20.NET\n\n### Leave a reply [Cancel reply](/aspnetcore-comparison-of-rebus-nservicebus-and-masstransit/#respond)\n\nYour email address will not be published. Required fields are marked \\*\n\nCOMMENT\n\nName \\*\n\nEmail \\*\n\nWebsite\n\n#### Courses – Code Maze\n\n[!\\[code maze courses side\\](https://code-maze.com/wp-content/uploads/2024/10/code-maze-courses-template-v3.png)](https://courses.code-maze.com/courses/)\n\nWhether you want to master web development or software architecture you should check our [COURSES](https://courses.code-maze.com/courses/) and pick the one that you like.\n\n#### Ad 1\n\n#### Ad 2\n\n#### Ad 3\n\n#### Ad 4",
  "PubDate": "2024-12-16T04:28:02+00:00"
}
